,question_id,poll_id,cycle,state,pollster_id,pollster,sponsor_ids,sponsors,display_name,pollster_rating_id,pollster_rating_name,fte_grade,sample_size,population,population_full,methodology,office_type,seat_number,seat_name,start_date,end_date,election_date,sponsor_candidate,internal,partisan,tracking,nationwide_batch,ranked_choice_reallocated,created_at,notes,url,stage,answer,candidate_name,candidate_party,pct,created_at_date,start_dt,end_dt,sum_pct,trump_net,max.pct,winner,dem_pct,dem_lead,state_abbrev,region,method_abbrev
0,116815,63513,2020,New Hampshire,1528,AtlasIntel,,,AtlasIntel,546,AtlasIntel,,1100.0,rv,rv,Online,U.S. President,0,,2/8/20,2020-02-10,,,False,,,False,False,2/10/20 22:24,,https://projects.fivethirtyeight.com/polls/20200210_NH.pdf,general,Sanders,Bernie Sanders,DEM,43.7,2020-02-10,2020-02-08,2020-02-10,43.7,0.0,46.9,NO,0.48233995584989003,-3.2,NH,North,Online
1,116815,63513,2020,New Hampshire,1528,AtlasIntel,,,AtlasIntel,546,AtlasIntel,,1100.0,rv,rv,Online,U.S. President,0,,2/8/20,2020-02-10,,,False,,,False,False,2/10/20 22:24,,https://projects.fivethirtyeight.com/polls/20200210_NH.pdf,general,Trump,Donald Trump,REP,46.9,2020-02-10,2020-02-08,2020-02-10,46.9,0.0,46.9,YES,0.48233995584989003,-3.2,NH,North,Online
2,116816,63513,2020,New Hampshire,1528,AtlasIntel,,,AtlasIntel,546,AtlasIntel,,1100.0,rv,rv,Online,U.S. President,0,,2/8/20,2020-02-10,,,False,,,False,False,2/10/20 22:24,,https://projects.fivethirtyeight.com/polls/20200210_NH.pdf,general,Warren,Elizabeth Warren,DEM,40.5,2020-02-10,2020-02-08,2020-02-10,40.5,0.0,46.8,NO,0.46391752577319606,-6.3,NH,North,Online
3,116816,63513,2020,New Hampshire,1528,AtlasIntel,,,AtlasIntel,546,AtlasIntel,,1100.0,rv,rv,Online,U.S. President,0,,2/8/20,2020-02-10,,,False,,,False,False,2/10/20 22:24,,https://projects.fivethirtyeight.com/polls/20200210_NH.pdf,general,Trump,Donald Trump,REP,46.8,2020-02-10,2020-02-08,2020-02-10,46.8,0.0,46.8,YES,0.46391752577319606,-6.3,NH,North,Online
4,116817,63513,2020,New Hampshire,1528,AtlasIntel,,,AtlasIntel,546,AtlasIntel,,1100.0,rv,rv,Online,U.S. President,0,,2/8/20,2020-02-10,,,False,,,False,False,2/10/20 22:24,,https://projects.fivethirtyeight.com/polls/20200210_NH.pdf,general,Biden,Joe Biden,DEM,43.5,2020-02-10,2020-02-08,2020-02-10,43.5,0.0,45.9,NO,0.486577181208054,-2.4,NH,North,Online
5,116817,63513,2020,New Hampshire,1528,AtlasIntel,,,AtlasIntel,546,AtlasIntel,,1100.0,rv,rv,Online,U.S. President,0,,2/8/20,2020-02-10,,,False,,,False,False,2/10/20 22:24,,https://projects.fivethirtyeight.com/polls/20200210_NH.pdf,general,Trump,Donald Trump,REP,45.9,2020-02-10,2020-02-08,2020-02-10,45.9,0.0,45.9,YES,0.486577181208054,-2.4,NH,North,Online
6,116818,63513,2020,New Hampshire,1528,AtlasIntel,,,AtlasIntel,546,AtlasIntel,,1100.0,rv,rv,Online,U.S. President,0,,2/8/20,2020-02-10,,,False,,,False,False,2/10/20 22:24,,https://projects.fivethirtyeight.com/polls/20200210_NH.pdf,general,Buttigieg,Pete Buttigieg,DEM,46.1,2020-02-10,2020-02-08,2020-02-10,46.1,0.0,46.1,YES,0.50437636761488,0.800000000000004,NH,North,Online
7,116818,63513,2020,New Hampshire,1528,AtlasIntel,,,AtlasIntel,546,AtlasIntel,,1100.0,rv,rv,Online,U.S. President,0,,2/8/20,2020-02-10,,,False,,,False,False,2/10/20 22:24,,https://projects.fivethirtyeight.com/polls/20200210_NH.pdf,general,Trump,Donald Trump,REP,45.3,2020-02-10,2020-02-08,2020-02-10,45.3,0.0,46.1,NO,0.50437636761488,0.800000000000004,NH,North,Online
8,116800,63511,2020,National,744,Ipsos,71,Reuters,Ipsos,154,Ipsos,B-,952.0,rv,rv,Online,U.S. President,0,,2/6/20,2020-02-10,,,False,,,False,False,2/10/20 18:40,,https://www.ipsos.com/sites/default/files/ct/news/documents/2020-02/topline_reuters_2020_election_tracker_02_10_2020_wu.pdf,general,Biden,Joe Biden,DEM,44.0,2020-02-10,2020-02-06,2020-02-10,44.0,0.0,44.0,YES,0.511627906976744,2.0,NA,National,Online
9,116800,63511,2020,National,744,Ipsos,71,Reuters,Ipsos,154,Ipsos,B-,952.0,rv,rv,Online,U.S. President,0,,2/6/20,2020-02-10,,,False,,,False,False,2/10/20 18:40,,https://www.ipsos.com/sites/default/files/ct/news/documents/2020-02/topline_reuters_2020_election_tracker_02_10_2020_wu.pdf,general,Trump,Donald Trump,REP,42.0,2020-02-10,2020-02-06,2020-02-10,42.0,0.0,44.0,NO,0.511627906976744,2.0,NA,National,Online
10,116801,63511,2020,National,744,Ipsos,71,Reuters,Ipsos,154,Ipsos,B-,952.0,rv,rv,Online,U.S. President,0,,2/6/20,2020-02-10,,,False,,,False,False,2/10/20 18:40,,https://www.ipsos.com/sites/default/files/ct/news/documents/2020-02/topline_reuters_2020_election_tracker_02_10_2020_wu.pdf,general,Sanders,Bernie Sanders,DEM,45.0,2020-02-10,2020-02-06,2020-02-10,45.0,0.0,45.0,YES,0.523255813953488,4.0,NA,National,Online
11,116801,63511,2020,National,744,Ipsos,71,Reuters,Ipsos,154,Ipsos,B-,952.0,rv,rv,Online,U.S. President,0,,2/6/20,2020-02-10,,,False,,,False,False,2/10/20 18:40,,https://www.ipsos.com/sites/default/files/ct/news/documents/2020-02/topline_reuters_2020_election_tracker_02_10_2020_wu.pdf,general,Trump,Donald Trump,REP,41.0,2020-02-10,2020-02-06,2020-02-10,41.0,0.0,45.0,NO,0.523255813953488,4.0,NA,National,Online
12,116802,63511,2020,National,744,Ipsos,71,Reuters,Ipsos,154,Ipsos,B-,952.0,rv,rv,Online,U.S. President,0,,2/6/20,2020-02-10,,,False,,,False,False,2/10/20 18:40,,https://www.ipsos.com/sites/default/files/ct/news/documents/2020-02/topline_reuters_2020_election_tracker_02_10_2020_wu.pdf,general,Trump,Donald Trump,REP,41.0,2020-02-10,2020-02-06,2020-02-10,41.0,0.0,45.0,NO,0.523255813953488,4.0,NA,National,Online
13,116803,63511,2020,National,744,Ipsos,71,Reuters,Ipsos,154,Ipsos,B-,952.0,rv,rv,Online,U.S. President,0,,2/6/20,2020-02-10,,,False,,,False,False,2/10/20 18:40,,https://www.ipsos.com/sites/default/files/ct/news/documents/2020-02/topline_reuters_2020_election_tracker_02_10_2020_wu.pdf,general,Warren,Elizabeth Warren,DEM,42.0,2020-02-10,2020-02-06,2020-02-10,42.0,0.0,42.0,YES,0.5,0.0,NA,National,Online
14,116803,63511,2020,National,744,Ipsos,71,Reuters,Ipsos,154,Ipsos,B-,952.0,rv,rv,Online,U.S. President,0,,2/6/20,2020-02-10,,,False,,,False,False,2/10/20 18:40,,https://www.ipsos.com/sites/default/files/ct/news/documents/2020-02/topline_reuters_2020_election_tracker_02_10_2020_wu.pdf,general,Trump,Donald Trump,REP,42.0,2020-02-10,2020-02-06,2020-02-10,42.0,0.0,42.0,YES,0.5,0.0,NA,National,Online
15,116804,63511,2020,National,744,Ipsos,71,Reuters,Ipsos,154,Ipsos,B-,952.0,rv,rv,Online,U.S. President,0,,2/6/20,2020-02-10,,,False,,,False,False,2/10/20 18:40,,https://www.ipsos.com/sites/default/files/ct/news/documents/2020-02/topline_reuters_2020_election_tracker_02_10_2020_wu.pdf,general,Buttigieg,Pete Buttigieg,DEM,41.0,2020-02-10,2020-02-06,2020-02-10,41.0,0.0,41.0,YES,0.5,0.0,NA,National,Online
16,116804,63511,2020,National,744,Ipsos,71,Reuters,Ipsos,154,Ipsos,B-,952.0,rv,rv,Online,U.S. President,0,,2/6/20,2020-02-10,,,False,,,False,False,2/10/20 18:40,,https://www.ipsos.com/sites/default/files/ct/news/documents/2020-02/topline_reuters_2020_election_tracker_02_10_2020_wu.pdf,general,Trump,Donald Trump,REP,41.0,2020-02-10,2020-02-06,2020-02-10,41.0,0.0,41.0,YES,0.5,0.0,NA,National,Online
17,116764,63496,2020,National,396,Quinnipiac University,,,Quinnipiac University,267,Quinnipiac University,B+,1159.0,rv,rv,Live Phone,U.S. President,0,,2/5/20,2020-02-09,,,False,,,False,False,2/10/20 14:17,,https://poll.qu.edu/national/release-detail?ReleaseID=3655,general,Biden,Joe Biden,DEM,50.0,2020-02-10,2020-02-05,2020-02-09,50.0,0.0,50.0,YES,0.537634408602151,7.0,NA,National,Phone
18,116764,63496,2020,National,396,Quinnipiac University,,,Quinnipiac University,267,Quinnipiac University,B+,1159.0,rv,rv,Live Phone,U.S. President,0,,2/5/20,2020-02-09,,,False,,,False,False,2/10/20 14:17,,https://poll.qu.edu/national/release-detail?ReleaseID=3655,general,Trump,Donald Trump,REP,43.0,2020-02-10,2020-02-05,2020-02-09,43.0,0.0,50.0,NO,0.537634408602151,7.0,NA,National,Phone
19,116765,63496,2020,National,396,Quinnipiac University,,,Quinnipiac University,267,Quinnipiac University,B+,1159.0,rv,rv,Live Phone,U.S. President,0,,2/5/20,2020-02-09,,,False,,,False,False,2/10/20 14:17,,https://poll.qu.edu/national/release-detail?ReleaseID=3655,general,Sanders,Bernie Sanders,DEM,51.0,2020-02-10,2020-02-05,2020-02-09,51.0,0.0,51.0,YES,0.5425531914893621,8.0,NA,National,Phone
20,116765,63496,2020,National,396,Quinnipiac University,,,Quinnipiac University,267,Quinnipiac University,B+,1159.0,rv,rv,Live Phone,U.S. President,0,,2/5/20,2020-02-09,,,False,,,False,False,2/10/20 14:17,,https://poll.qu.edu/national/release-detail?ReleaseID=3655,general,Trump,Donald Trump,REP,43.0,2020-02-10,2020-02-05,2020-02-09,43.0,0.0,51.0,NO,0.5425531914893621,8.0,NA,National,Phone
21,116766,63496,2020,National,396,Quinnipiac University,,,Quinnipiac University,267,Quinnipiac University,B+,1159.0,rv,rv,Live Phone,U.S. President,0,,2/5/20,2020-02-09,,,False,,,False,False,2/10/20 14:17,,https://poll.qu.edu/national/release-detail?ReleaseID=3655,general,Warren,Elizabeth Warren,DEM,48.0,2020-02-10,2020-02-05,2020-02-09,48.0,0.0,48.0,YES,0.5217391304347829,4.0,NA,National,Phone
22,116766,63496,2020,National,396,Quinnipiac University,,,Quinnipiac University,267,Quinnipiac University,B+,1159.0,rv,rv,Live Phone,U.S. President,0,,2/5/20,2020-02-09,,,False,,,False,False,2/10/20 14:17,,https://poll.qu.edu/national/release-detail?ReleaseID=3655,general,Trump,Donald Trump,REP,44.0,2020-02-10,2020-02-05,2020-02-09,44.0,0.0,48.0,NO,0.5217391304347829,4.0,NA,National,Phone
23,116767,63496,2020,National,396,Quinnipiac University,,,Quinnipiac University,267,Quinnipiac University,B+,1159.0,rv,rv,Live Phone,U.S. President,0,,2/5/20,2020-02-09,,,False,,,False,False,2/10/20 14:17,,https://poll.qu.edu/national/release-detail?ReleaseID=3655,general,Buttigieg,Pete Buttigieg,DEM,47.0,2020-02-10,2020-02-05,2020-02-09,47.0,0.0,47.0,YES,0.522222222222222,4.0,NA,National,Phone
24,116767,63496,2020,National,396,Quinnipiac University,,,Quinnipiac University,267,Quinnipiac University,B+,1159.0,rv,rv,Live Phone,U.S. President,0,,2/5/20,2020-02-09,,,False,,,False,False,2/10/20 14:17,,https://poll.qu.edu/national/release-detail?ReleaseID=3655,general,Trump,Donald Trump,REP,43.0,2020-02-10,2020-02-05,2020-02-09,43.0,0.0,47.0,NO,0.522222222222222,4.0,NA,National,Phone
25,116768,63496,2020,National,396,Quinnipiac University,,,Quinnipiac University,267,Quinnipiac University,B+,1159.0,rv,rv,Live Phone,U.S. President,0,,2/5/20,2020-02-09,,,False,,,False,False,2/10/20 14:17,,https://poll.qu.edu/national/release-detail?ReleaseID=3655,general,Klobuchar,Amy Klobuchar,DEM,49.0,2020-02-10,2020-02-05,2020-02-09,49.0,0.0,49.0,YES,0.532608695652174,6.0,NA,National,Phone
26,116768,63496,2020,National,396,Quinnipiac University,,,Quinnipiac University,267,Quinnipiac University,B+,1159.0,rv,rv,Live Phone,U.S. President,0,,2/5/20,2020-02-09,,,False,,,False,False,2/10/20 14:17,,https://poll.qu.edu/national/release-detail?ReleaseID=3655,general,Trump,Donald Trump,REP,43.0,2020-02-10,2020-02-05,2020-02-09,43.0,0.0,49.0,NO,0.532608695652174,6.0,NA,National,Phone
27,116769,63496,2020,National,396,Quinnipiac University,,,Quinnipiac University,267,Quinnipiac University,B+,1159.0,rv,rv,Live Phone,U.S. President,0,,2/5/20,2020-02-09,,,False,,,False,False,2/10/20 14:17,,https://poll.qu.edu/national/release-detail?ReleaseID=3655,general,Trump,Donald Trump,REP,42.0,2020-02-10,2020-02-05,2020-02-09,42.0,0.0,51.0,NO,0.548387096774194,9.0,NA,National,Phone
28,116820,63514,2020,National,1189,Morning Consult,,,Morning Consult,218,Morning Consult,B/C,9045.0,rv,rv,Online,U.S. President,0,,2/4/20,2020-02-09,,,False,,,False,False,2/11/20 08:29,,https://morningconsult.com/2020-democratic-primary/,general,Trump,Donald Trump,REP,41.0,2020-02-11,2020-02-04,2020-02-09,41.0,0.0,46.0,NO,0.528735632183908,5.0,NA,National,Online
29,116821,63514,2020,National,1189,Morning Consult,,,Morning Consult,218,Morning Consult,B/C,9045.0,rv,rv,Online,U.S. President,0,,2/4/20,2020-02-09,,,False,,,False,False,2/11/20 08:29,,https://morningconsult.com/2020-democratic-primary/,general,Biden,Joe Biden,DEM,45.0,2020-02-11,2020-02-04,2020-02-09,45.0,0.0,45.0,YES,0.517241379310345,3.0,NA,National,Online
30,116821,63514,2020,National,1189,Morning Consult,,,Morning Consult,218,Morning Consult,B/C,9045.0,rv,rv,Online,U.S. President,0,,2/4/20,2020-02-09,,,False,,,False,False,2/11/20 08:29,,https://morningconsult.com/2020-democratic-primary/,general,Trump,Donald Trump,REP,42.0,2020-02-11,2020-02-04,2020-02-09,42.0,0.0,45.0,NO,0.517241379310345,3.0,NA,National,Online
31,116822,63514,2020,National,1189,Morning Consult,,,Morning Consult,218,Morning Consult,B/C,9045.0,rv,rv,Online,U.S. President,0,,2/4/20,2020-02-09,,,False,,,False,False,2/11/20 08:29,,https://morningconsult.com/2020-democratic-primary/,general,Sanders,Bernie Sanders,DEM,45.0,2020-02-11,2020-02-04,2020-02-09,45.0,0.0,45.0,YES,0.5113636363636359,2.0,NA,National,Online
32,116822,63514,2020,National,1189,Morning Consult,,,Morning Consult,218,Morning Consult,B/C,9045.0,rv,rv,Online,U.S. President,0,,2/4/20,2020-02-09,,,False,,,False,False,2/11/20 08:29,,https://morningconsult.com/2020-democratic-primary/,general,Trump,Donald Trump,REP,43.0,2020-02-11,2020-02-04,2020-02-09,43.0,0.0,45.0,NO,0.5113636363636359,2.0,NA,National,Online
33,116823,63514,2020,National,1189,Morning Consult,,,Morning Consult,218,Morning Consult,B/C,9045.0,rv,rv,Online,U.S. President,0,,2/4/20,2020-02-09,,,False,,,False,False,2/11/20 08:29,,https://morningconsult.com/2020-democratic-primary/,general,Warren,Elizabeth Warren,DEM,43.0,2020-02-11,2020-02-04,2020-02-09,43.0,0.0,43.0,YES,0.5,0.0,NA,National,Online
34,116823,63514,2020,National,1189,Morning Consult,,,Morning Consult,218,Morning Consult,B/C,9045.0,rv,rv,Online,U.S. President,0,,2/4/20,2020-02-09,,,False,,,False,False,2/11/20 08:29,,https://morningconsult.com/2020-democratic-primary/,general,Trump,Donald Trump,REP,43.0,2020-02-11,2020-02-04,2020-02-09,43.0,0.0,43.0,YES,0.5,0.0,NA,National,Online
35,116824,63514,2020,National,1189,Morning Consult,,,Morning Consult,218,Morning Consult,B/C,9045.0,rv,rv,Online,U.S. President,0,,2/4/20,2020-02-09,,,False,,,False,False,2/11/20 08:29,,https://morningconsult.com/2020-democratic-primary/,general,Buttigieg,Pete Buttigieg,DEM,43.0,2020-02-11,2020-02-04,2020-02-09,43.0,0.0,43.0,YES,0.505882352941176,1.0,NA,National,Online
36,116824,63514,2020,National,1189,Morning Consult,,,Morning Consult,218,Morning Consult,B/C,9045.0,rv,rv,Online,U.S. President,0,,2/4/20,2020-02-09,,,False,,,False,False,2/11/20 08:29,,https://morningconsult.com/2020-democratic-primary/,general,Trump,Donald Trump,REP,42.0,2020-02-11,2020-02-04,2020-02-09,42.0,0.0,43.0,NO,0.505882352941176,1.0,NA,National,Online
37,116836,63515,2020,Alabama,289,Mason-Dixon Polling & Research Inc.,"780,1236,1237",WBRC-TV | Alabama Daily News | WAFF-TV,Mason-Dixon Polling & Research Inc.,197,Mason-Dixon Polling & Research Inc.,B+,625.0,rv,rv,Live Phone,U.S. President,0,,2/4/20,2020-02-06,,,False,,,False,False,2/11/20 08:47,,https://www.aldailynews.com/trump-leads-democratic-contenders-in-alabama-poll/,general,Warren,Elizabeth Warren,DEM,35.0,2020-02-11,2020-02-04,2020-02-06,35.0,0.0,62.0,NO,0.360824742268041,-27.0,AL,South,Phone
38,116836,63515,2020,Alabama,289,Mason-Dixon Polling & Research Inc.,"780,1236,1237",WBRC-TV | Alabama Daily News | WAFF-TV,Mason-Dixon Polling & Research Inc.,197,Mason-Dixon Polling & Research Inc.,B+,625.0,rv,rv,Live Phone,U.S. President,0,,2/4/20,2020-02-06,,,False,,,False,False,2/11/20 08:47,,https://www.aldailynews.com/trump-leads-democratic-contenders-in-alabama-poll/,general,Trump,Donald Trump,REP,62.0,2020-02-11,2020-02-04,2020-02-06,62.0,0.0,62.0,YES,0.360824742268041,-27.0,AL,South,Phone
39,116837,63515,2020,Alabama,289,Mason-Dixon Polling & Research Inc.,"780,1236,1237",WBRC-TV | Alabama Daily News | WAFF-TV,Mason-Dixon Polling & Research Inc.,197,Mason-Dixon Polling & Research Inc.,B+,625.0,rv,rv,Live Phone,U.S. President,0,,2/4/20,2020-02-06,,,False,,,False,False,2/11/20 08:47,,https://www.aldailynews.com/trump-leads-democratic-contenders-in-alabama-poll/,general,Trump,Donald Trump,REP,54.0,2020-02-11,2020-02-04,2020-02-06,54.0,0.0,54.0,YES,0.425531914893617,-14.0,AL,South,Phone
40,116838,63515,2020,Alabama,289,Mason-Dixon Polling & Research Inc.,"780,1236,1237",WBRC-TV | Alabama Daily News | WAFF-TV,Mason-Dixon Polling & Research Inc.,197,Mason-Dixon Polling & Research Inc.,B+,625.0,rv,rv,Live Phone,U.S. President,0,,2/4/20,2020-02-06,,,False,,,False,False,2/11/20 08:47,,https://www.aldailynews.com/trump-leads-democratic-contenders-in-alabama-poll/,general,Buttigieg,Pete Buttigieg,DEM,37.0,2020-02-11,2020-02-04,2020-02-06,37.0,0.0,58.0,NO,0.38947368421052597,-21.0,AL,South,Phone
41,116838,63515,2020,Alabama,289,Mason-Dixon Polling & Research Inc.,"780,1236,1237",WBRC-TV | Alabama Daily News | WAFF-TV,Mason-Dixon Polling & Research Inc.,197,Mason-Dixon Polling & Research Inc.,B+,625.0,rv,rv,Live Phone,U.S. President,0,,2/4/20,2020-02-06,,,False,,,False,False,2/11/20 08:47,,https://www.aldailynews.com/trump-leads-democratic-contenders-in-alabama-poll/,general,Trump,Donald Trump,REP,58.0,2020-02-11,2020-02-04,2020-02-06,58.0,0.0,58.0,YES,0.38947368421052597,-21.0,AL,South,Phone
42,116839,63515,2020,Alabama,289,Mason-Dixon Polling & Research Inc.,"780,1236,1237",WBRC-TV | Alabama Daily News | WAFF-TV,Mason-Dixon Polling & Research Inc.,197,Mason-Dixon Polling & Research Inc.,B+,625.0,rv,rv,Live Phone,U.S. President,0,,2/4/20,2020-02-06,,,False,,,False,False,2/11/20 08:47,,https://www.aldailynews.com/trump-leads-democratic-contenders-in-alabama-poll/,general,Biden,Joe Biden,DEM,38.0,2020-02-11,2020-02-04,2020-02-06,38.0,0.0,58.0,NO,0.3958333333333329,-20.0,AL,South,Phone
43,116839,63515,2020,Alabama,289,Mason-Dixon Polling & Research Inc.,"780,1236,1237",WBRC-TV | Alabama Daily News | WAFF-TV,Mason-Dixon Polling & Research Inc.,197,Mason-Dixon Polling & Research Inc.,B+,625.0,rv,rv,Live Phone,U.S. President,0,,2/4/20,2020-02-06,,,False,,,False,False,2/11/20 08:47,,https://www.aldailynews.com/trump-leads-democratic-contenders-in-alabama-poll/,general,Trump,Donald Trump,REP,58.0,2020-02-11,2020-02-04,2020-02-06,58.0,0.0,58.0,YES,0.3958333333333329,-20.0,AL,South,Phone
44,116840,63515,2020,Alabama,289,Mason-Dixon Polling & Research Inc.,"780,1236,1237",WBRC-TV | Alabama Daily News | WAFF-TV,Mason-Dixon Polling & Research Inc.,197,Mason-Dixon Polling & Research Inc.,B+,625.0,rv,rv,Live Phone,U.S. President,0,,2/4/20,2020-02-06,,,False,,,False,False,2/11/20 08:47,,https://www.aldailynews.com/trump-leads-democratic-contenders-in-alabama-poll/,general,Sanders,Bernie Sanders,DEM,37.0,2020-02-11,2020-02-04,2020-02-06,37.0,0.0,60.0,NO,0.38144329896907203,-23.0,AL,South,Phone
45,116840,63515,2020,Alabama,289,Mason-Dixon Polling & Research Inc.,"780,1236,1237",WBRC-TV | Alabama Daily News | WAFF-TV,Mason-Dixon Polling & Research Inc.,197,Mason-Dixon Polling & Research Inc.,B+,625.0,rv,rv,Live Phone,U.S. President,0,,2/4/20,2020-02-06,,,False,,,False,False,2/11/20 08:47,,https://www.aldailynews.com/trump-leads-democratic-contenders-in-alabama-poll/,general,Trump,Donald Trump,REP,60.0,2020-02-11,2020-02-04,2020-02-06,60.0,0.0,60.0,YES,0.38144329896907203,-23.0,AL,South,Phone
46,116793,63509,2020,Kansas,788,DFM Research,789,SMART Transportation Division,DFM Research,69,DFM Research,B/C,600.0,a,a,Live Phone,U.S. President,0,,1/30/20,2020-02-06,,,False,DEM,,False,False,2/10/20 16:42,,http://www.dfmresearch.com/uploads/2020_Kansas_Rail_Survey__Amtrak_Topline.pdf,general,Biden,Joe Biden,DEM,43.0,2020-02-10,2020-01-30,2020-02-06,43.0,0.0,51.0,NO,0.45744680851063796,-8.0,KS,Midwest,Phone
47,116793,63509,2020,Kansas,788,DFM Research,789,SMART Transportation Division,DFM Research,69,DFM Research,B/C,600.0,a,a,Live Phone,U.S. President,0,,1/30/20,2020-02-06,,,False,DEM,,False,False,2/10/20 16:42,,http://www.dfmresearch.com/uploads/2020_Kansas_Rail_Survey__Amtrak_Topline.pdf,general,Trump,Donald Trump,REP,51.0,2020-02-10,2020-01-30,2020-02-06,51.0,0.0,51.0,YES,0.45744680851063796,-8.0,KS,Midwest,Phone
48,116794,63509,2020,Kansas,788,DFM Research,789,SMART Transportation Division,DFM Research,69,DFM Research,B/C,600.0,a,a,Live Phone,U.S. President,0,,1/30/20,2020-02-06,,,False,DEM,,False,False,2/10/20 16:42,,http://www.dfmresearch.com/uploads/2020_Kansas_Rail_Survey__Amtrak_Topline.pdf,general,Sanders,Bernie Sanders,DEM,43.0,2020-02-10,2020-01-30,2020-02-06,43.0,0.0,53.0,NO,0.4479166666666671,-10.0,KS,Midwest,Phone
49,116794,63509,2020,Kansas,788,DFM Research,789,SMART Transportation Division,DFM Research,69,DFM Research,B/C,600.0,a,a,Live Phone,U.S. President,0,,1/30/20,2020-02-06,,,False,DEM,,False,False,2/10/20 16:42,,http://www.dfmresearch.com/uploads/2020_Kansas_Rail_Survey__Amtrak_Topline.pdf,general,Trump,Donald Trump,REP,53.0,2020-02-10,2020-01-30,2020-02-06,53.0,0.0,53.0,YES,0.4479166666666671,-10.0,KS,Midwest,Phone
50,116795,63509,2020,Kansas,788,DFM Research,789,SMART Transportation Division,DFM Research,69,DFM Research,B/C,600.0,a,a,Live Phone,U.S. President,0,,1/30/20,2020-02-06,,,False,DEM,,False,False,2/10/20 16:42,,http://www.dfmresearch.com/uploads/2020_Kansas_Rail_Survey__Amtrak_Topline.pdf,general,Trump,Donald Trump,REP,50.0,2020-02-10,2020-01-30,2020-02-06,50.0,0.0,50.0,YES,0.462365591397849,-7.0,KS,Midwest,Phone
51,116796,63509,2020,Kansas,788,DFM Research,789,SMART Transportation Division,DFM Research,69,DFM Research,B/C,600.0,a,a,Live Phone,U.S. President,0,,1/30/20,2020-02-06,,,False,DEM,,False,False,2/10/20 16:42,,http://www.dfmresearch.com/uploads/2020_Kansas_Rail_Survey__Amtrak_Topline.pdf,general,Warren,Elizabeth Warren,DEM,41.0,2020-02-10,2020-01-30,2020-02-06,41.0,0.0,53.0,NO,0.436170212765957,-12.0,KS,Midwest,Phone
52,116796,63509,2020,Kansas,788,DFM Research,789,SMART Transportation Division,DFM Research,69,DFM Research,B/C,600.0,a,a,Live Phone,U.S. President,0,,1/30/20,2020-02-06,,,False,DEM,,False,False,2/10/20 16:42,,http://www.dfmresearch.com/uploads/2020_Kansas_Rail_Survey__Amtrak_Topline.pdf,general,Trump,Donald Trump,REP,53.0,2020-02-10,2020-01-30,2020-02-06,53.0,0.0,53.0,YES,0.436170212765957,-12.0,KS,Midwest,Phone
53,116697,63477,2020,New Hampshire,294,McLaughlin & Associates,112,American Conservative Union,McLaughlin & Associates,203,McLaughlin & Associates,C/D,400.0,lv,lv,Live Phone,U.S. President,0,,2/4/20,2020-02-05,,,False,REP,,False,False,2/7/20 13:09,horserace source: https://twitter.com/JMcLaughlinSTK/status/1225720335942717440,https://www.insidesources.com/n-h-voters-oppose-medicare-for-all-by-2-to-1-margin/,general,Biden,Joe Biden,DEM,45.0,2020-02-07,2020-02-04,2020-02-05,45.0,0.0,49.0,NO,0.47872340425531895,-4.0,NH,North,Phone
54,116697,63477,2020,New Hampshire,294,McLaughlin & Associates,112,American Conservative Union,McLaughlin & Associates,203,McLaughlin & Associates,C/D,400.0,lv,lv,Live Phone,U.S. President,0,,2/4/20,2020-02-05,,,False,REP,,False,False,2/7/20 13:09,horserace source: https://twitter.com/JMcLaughlinSTK/status/1225720335942717440,https://www.insidesources.com/n-h-voters-oppose-medicare-for-all-by-2-to-1-margin/,general,Trump,Donald Trump,REP,49.0,2020-02-07,2020-02-04,2020-02-05,49.0,0.0,49.0,YES,0.47872340425531895,-4.0,NH,North,Phone
55,116698,63477,2020,New Hampshire,294,McLaughlin & Associates,112,American Conservative Union,McLaughlin & Associates,203,McLaughlin & Associates,C/D,400.0,lv,lv,Live Phone,U.S. President,0,,2/4/20,2020-02-05,,,False,REP,,False,False,2/7/20 13:09,horserace source: https://twitter.com/JMcLaughlinSTK/status/1225720335942717440,https://www.insidesources.com/n-h-voters-oppose-medicare-for-all-by-2-to-1-margin/,general,Sanders,Bernie Sanders,DEM,45.0,2020-02-07,2020-02-04,2020-02-05,45.0,0.0,48.0,NO,0.48387096774193505,-3.0,NH,North,Phone
56,116698,63477,2020,New Hampshire,294,McLaughlin & Associates,112,American Conservative Union,McLaughlin & Associates,203,McLaughlin & Associates,C/D,400.0,lv,lv,Live Phone,U.S. President,0,,2/4/20,2020-02-05,,,False,REP,,False,False,2/7/20 13:09,horserace source: https://twitter.com/JMcLaughlinSTK/status/1225720335942717440,https://www.insidesources.com/n-h-voters-oppose-medicare-for-all-by-2-to-1-margin/,general,Trump,Donald Trump,REP,48.0,2020-02-07,2020-02-04,2020-02-05,48.0,0.0,48.0,YES,0.48387096774193505,-3.0,NH,North,Phone
57,116674,63470,2020,South Carolina,1516,East Carolina University,,,East Carolina University,523,East Carolina University,,1756.0,rv,rv,IVR/Online,U.S. President,0,,1/31/20,2020-02-02,,,False,,,False,False,2/6/20 19:33,,https://surveyresearch-ecu.reportablenews.com/pr/south-carolina-poll-biden-leads-presidential-primary-among-likely-democratic-voters-but-many-open-to-changing-their-mind-before-election-day-trump-and-graham-lead-comfortably-in-general-election-matchups,general,Biden,Joe Biden,DEM,40.0,2020-02-06,2020-01-31,2020-02-02,40.0,0.0,52.0,NO,0.43478260869565205,-12.0,SC,South,Hybrid
58,116674,63470,2020,South Carolina,1516,East Carolina University,,,East Carolina University,523,East Carolina University,,1756.0,rv,rv,IVR/Online,U.S. President,0,,1/31/20,2020-02-02,,,False,,,False,False,2/6/20 19:33,,https://surveyresearch-ecu.reportablenews.com/pr/south-carolina-poll-biden-leads-presidential-primary-among-likely-democratic-voters-but-many-open-to-changing-their-mind-before-election-day-trump-and-graham-lead-comfortably-in-general-election-matchups,general,Trump,Donald Trump,REP,52.0,2020-02-06,2020-01-31,2020-02-02,52.0,0.0,52.0,YES,0.43478260869565205,-12.0,SC,South,Hybrid
59,116675,63470,2020,South Carolina,1516,East Carolina University,,,East Carolina University,523,East Carolina University,,1756.0,rv,rv,IVR/Online,U.S. President,0,,1/31/20,2020-02-02,,,False,,,False,False,2/6/20 19:33,,https://surveyresearch-ecu.reportablenews.com/pr/south-carolina-poll-biden-leads-presidential-primary-among-likely-democratic-voters-but-many-open-to-changing-their-mind-before-election-day-trump-and-graham-lead-comfortably-in-general-election-matchups,general,Sanders,Bernie Sanders,DEM,40.0,2020-02-06,2020-01-31,2020-02-02,40.0,0.0,52.0,NO,0.43478260869565205,-12.0,SC,South,Hybrid
60,116675,63470,2020,South Carolina,1516,East Carolina University,,,East Carolina University,523,East Carolina University,,1756.0,rv,rv,IVR/Online,U.S. President,0,,1/31/20,2020-02-02,,,False,,,False,False,2/6/20 19:33,,https://surveyresearch-ecu.reportablenews.com/pr/south-carolina-poll-biden-leads-presidential-primary-among-likely-democratic-voters-but-many-open-to-changing-their-mind-before-election-day-trump-and-graham-lead-comfortably-in-general-election-matchups,general,Trump,Donald Trump,REP,52.0,2020-02-06,2020-01-31,2020-02-02,52.0,0.0,52.0,YES,0.43478260869565205,-12.0,SC,South,Hybrid
61,116676,63470,2020,South Carolina,1516,East Carolina University,,,East Carolina University,523,East Carolina University,,1756.0,rv,rv,IVR/Online,U.S. President,0,,1/31/20,2020-02-02,,,False,,,False,False,2/6/20 19:33,,https://surveyresearch-ecu.reportablenews.com/pr/south-carolina-poll-biden-leads-presidential-primary-among-likely-democratic-voters-but-many-open-to-changing-their-mind-before-election-day-trump-and-graham-lead-comfortably-in-general-election-matchups,general,Trump,Donald Trump,REP,52.0,2020-02-06,2020-01-31,2020-02-02,52.0,0.0,52.0,YES,0.42857142857142894,-13.0,SC,South,Hybrid
62,116677,63470,2020,South Carolina,1516,East Carolina University,,,East Carolina University,523,East Carolina University,,1756.0,rv,rv,IVR/Online,U.S. President,0,,1/31/20,2020-02-02,,,False,,,False,False,2/6/20 19:33,,https://surveyresearch-ecu.reportablenews.com/pr/south-carolina-poll-biden-leads-presidential-primary-among-likely-democratic-voters-but-many-open-to-changing-their-mind-before-election-day-trump-and-graham-lead-comfortably-in-general-election-matchups,general,Warren,Elizabeth Warren,DEM,36.0,2020-02-06,2020-01-31,2020-02-02,36.0,0.0,54.0,NO,0.4,-18.0,SC,South,Hybrid
63,116677,63470,2020,South Carolina,1516,East Carolina University,,,East Carolina University,523,East Carolina University,,1756.0,rv,rv,IVR/Online,U.S. President,0,,1/31/20,2020-02-02,,,False,,,False,False,2/6/20 19:33,,https://surveyresearch-ecu.reportablenews.com/pr/south-carolina-poll-biden-leads-presidential-primary-among-likely-democratic-voters-but-many-open-to-changing-their-mind-before-election-day-trump-and-graham-lead-comfortably-in-general-election-matchups,general,Trump,Donald Trump,REP,54.0,2020-02-06,2020-01-31,2020-02-02,54.0,0.0,54.0,YES,0.4,-18.0,SC,South,Hybrid
64,116678,63470,2020,South Carolina,1516,East Carolina University,,,East Carolina University,523,East Carolina University,,1756.0,rv,rv,IVR/Online,U.S. President,0,,1/31/20,2020-02-02,,,False,,,False,False,2/6/20 19:33,,https://surveyresearch-ecu.reportablenews.com/pr/south-carolina-poll-biden-leads-presidential-primary-among-likely-democratic-voters-but-many-open-to-changing-their-mind-before-election-day-trump-and-graham-lead-comfortably-in-general-election-matchups,general,Buttigieg,Pete Buttigieg,DEM,34.0,2020-02-06,2020-01-31,2020-02-02,34.0,0.0,52.0,NO,0.39534883720930203,-18.0,SC,South,Hybrid
65,116678,63470,2020,South Carolina,1516,East Carolina University,,,East Carolina University,523,East Carolina University,,1756.0,rv,rv,IVR/Online,U.S. President,0,,1/31/20,2020-02-02,,,False,,,False,False,2/6/20 19:33,,https://surveyresearch-ecu.reportablenews.com/pr/south-carolina-poll-biden-leads-presidential-primary-among-likely-democratic-voters-but-many-open-to-changing-their-mind-before-election-day-trump-and-graham-lead-comfortably-in-general-election-matchups,general,Trump,Donald Trump,REP,52.0,2020-02-06,2020-01-31,2020-02-02,52.0,0.0,52.0,YES,0.39534883720930203,-18.0,SC,South,Hybrid
66,116679,63470,2020,South Carolina,1516,East Carolina University,,,East Carolina University,523,East Carolina University,,1756.0,rv,rv,IVR/Online,U.S. President,0,,1/31/20,2020-02-02,,,False,,,False,False,2/6/20 19:33,,https://surveyresearch-ecu.reportablenews.com/pr/south-carolina-poll-biden-leads-presidential-primary-among-likely-democratic-voters-but-many-open-to-changing-their-mind-before-election-day-trump-and-graham-lead-comfortably-in-general-election-matchups,general,Trump,Donald Trump,REP,52.0,2020-02-06,2020-01-31,2020-02-02,52.0,0.0,52.0,YES,0.39534883720930203,-18.0,SC,South,Hybrid
67,116680,63470,2020,South Carolina,1516,East Carolina University,,,East Carolina University,523,East Carolina University,,1756.0,rv,rv,IVR/Online,U.S. President,0,,1/31/20,2020-02-02,,,False,,,False,False,2/6/20 19:33,,https://surveyresearch-ecu.reportablenews.com/pr/south-carolina-poll-biden-leads-presidential-primary-among-likely-democratic-voters-but-many-open-to-changing-their-mind-before-election-day-trump-and-graham-lead-comfortably-in-general-election-matchups,general,Klobuchar,Amy Klobuchar,DEM,32.0,2020-02-06,2020-01-31,2020-02-02,32.0,0.0,52.0,NO,0.38095238095238104,-20.0,SC,South,Hybrid
68,116680,63470,2020,South Carolina,1516,East Carolina University,,,East Carolina University,523,East Carolina University,,1756.0,rv,rv,IVR/Online,U.S. President,0,,1/31/20,2020-02-02,,,False,,,False,False,2/6/20 19:33,,https://surveyresearch-ecu.reportablenews.com/pr/south-carolina-poll-biden-leads-presidential-primary-among-likely-democratic-voters-but-many-open-to-changing-their-mind-before-election-day-trump-and-graham-lead-comfortably-in-general-election-matchups,general,Trump,Donald Trump,REP,52.0,2020-02-06,2020-01-31,2020-02-02,52.0,0.0,52.0,YES,0.38095238095238104,-20.0,SC,South,Hybrid
69,116681,63470,2020,South Carolina,1516,East Carolina University,,,East Carolina University,523,East Carolina University,,1756.0,rv,rv,IVR/Online,U.S. President,0,,1/31/20,2020-02-02,,,False,,,False,False,2/6/20 19:33,,https://surveyresearch-ecu.reportablenews.com/pr/south-carolina-poll-biden-leads-presidential-primary-among-likely-democratic-voters-but-many-open-to-changing-their-mind-before-election-day-trump-and-graham-lead-comfortably-in-general-election-matchups,general,Trump,Donald Trump,REP,53.0,2020-02-06,2020-01-31,2020-02-02,53.0,0.0,53.0,YES,0.38372093023255793,-20.0,SC,South,Hybrid
70,116543,63435,2020,National,1528,AtlasIntel,,,AtlasIntel,546,AtlasIntel,,1600.0,rv,rv,Online,U.S. President,0,,1/30/20,2020-02-02,,,False,,,False,False,2/3/20 16:55,,https://projects.fivethirtyeight.com/polls/20200203_National.pdf,general,Sanders,Bernie Sanders,DEM,47.2,2020-02-03,2020-01-30,2020-02-02,47.2,0.0,47.2,YES,0.5124864277958739,2.3,NA,National,Online
71,116543,63435,2020,National,1528,AtlasIntel,,,AtlasIntel,546,AtlasIntel,,1600.0,rv,rv,Online,U.S. President,0,,1/30/20,2020-02-02,,,False,,,False,False,2/3/20 16:55,,https://projects.fivethirtyeight.com/polls/20200203_National.pdf,general,Trump,Donald Trump,REP,44.9,2020-02-03,2020-01-30,2020-02-02,44.9,0.0,47.2,NO,0.5124864277958739,2.3,NA,National,Online
72,116544,63435,2020,National,1528,AtlasIntel,,,AtlasIntel,546,AtlasIntel,,1600.0,rv,rv,Online,U.S. President,0,,1/30/20,2020-02-02,,,False,,,False,False,2/3/20 16:55,,https://projects.fivethirtyeight.com/polls/20200203_National.pdf,general,Warren,Elizabeth Warren,DEM,42.5,2020-02-03,2020-01-30,2020-02-02,42.5,0.0,45.7,NO,0.48185941043083896,-3.2,NA,National,Online
73,116544,63435,2020,National,1528,AtlasIntel,,,AtlasIntel,546,AtlasIntel,,1600.0,rv,rv,Online,U.S. President,0,,1/30/20,2020-02-02,,,False,,,False,False,2/3/20 16:55,,https://projects.fivethirtyeight.com/polls/20200203_National.pdf,general,Trump,Donald Trump,REP,45.7,2020-02-03,2020-01-30,2020-02-02,45.7,0.0,45.7,YES,0.48185941043083896,-3.2,NA,National,Online
74,116545,63435,2020,National,1528,AtlasIntel,,,AtlasIntel,546,AtlasIntel,,1600.0,rv,rv,Online,U.S. President,0,,1/30/20,2020-02-02,,,False,,,False,False,2/3/20 16:56,,https://projects.fivethirtyeight.com/polls/20200203_National.pdf,general,Biden,Joe Biden,DEM,45.8,2020-02-03,2020-01-30,2020-02-02,45.8,0.0,45.8,YES,0.50219298245614,0.39999999999999897,NA,National,Online
75,116545,63435,2020,National,1528,AtlasIntel,,,AtlasIntel,546,AtlasIntel,,1600.0,rv,rv,Online,U.S. President,0,,1/30/20,2020-02-02,,,False,,,False,False,2/3/20 16:56,,https://projects.fivethirtyeight.com/polls/20200203_National.pdf,general,Trump,Donald Trump,REP,45.4,2020-02-03,2020-01-30,2020-02-02,45.4,0.0,45.8,NO,0.50219298245614,0.39999999999999897,NA,National,Online
76,116546,63435,2020,National,1528,AtlasIntel,,,AtlasIntel,546,AtlasIntel,,1600.0,rv,rv,Online,U.S. President,0,,1/30/20,2020-02-02,,,False,,,False,False,2/3/20 16:56,,https://projects.fivethirtyeight.com/polls/20200203_National.pdf,general,Buttigieg,Pete Buttigieg,DEM,44.6,2020-02-03,2020-01-30,2020-02-02,44.6,0.0,44.6,YES,0.5016872890888641,0.30000000000000393,NA,National,Online
77,116546,63435,2020,National,1528,AtlasIntel,,,AtlasIntel,546,AtlasIntel,,1600.0,rv,rv,Online,U.S. President,0,,1/30/20,2020-02-02,,,False,,,False,False,2/3/20 16:56,,https://projects.fivethirtyeight.com/polls/20200203_National.pdf,general,Trump,Donald Trump,REP,44.3,2020-02-03,2020-01-30,2020-02-02,44.3,0.0,44.6,NO,0.5016872890888641,0.30000000000000393,NA,National,Online
78,116547,63435,2020,National,1528,AtlasIntel,,,AtlasIntel,546,AtlasIntel,,1600.0,rv,rv,Online,U.S. President,0,,1/30/20,2020-02-02,,,False,,,False,False,2/3/20 16:56,,https://projects.fivethirtyeight.com/polls/20200203_National.pdf,general,Trump,Donald Trump,REP,44.6,2020-02-03,2020-01-30,2020-02-02,44.6,0.0,44.6,YES,0.492027334851936,-1.4,NA,National,Online
79,116515,63433,2020,National,1189,Morning Consult,,,Morning Consult,218,Morning Consult,B/C,7178.0,rv,rv,Online,U.S. President,0,,1/27/20,2020-02-02,,,False,,,False,False,2/3/20 13:37,,https://morningconsult.com/2020-democratic-primary/,general,Trump,Donald Trump,REP,40.0,2020-02-03,2020-01-27,2020-02-02,40.0,0.0,47.0,NO,0.540229885057471,7.0,NA,National,Online
80,116516,63433,2020,National,1189,Morning Consult,,,Morning Consult,218,Morning Consult,B/C,7178.0,rv,rv,Online,U.S. President,0,,1/27/20,2020-02-02,,,False,,,False,False,2/3/20 13:37,,https://morningconsult.com/2020-democratic-primary/,general,Biden,Joe Biden,DEM,46.0,2020-02-03,2020-01-27,2020-02-02,46.0,0.0,46.0,YES,0.5227272727272729,4.0,NA,National,Online
81,116516,63433,2020,National,1189,Morning Consult,,,Morning Consult,218,Morning Consult,B/C,7178.0,rv,rv,Online,U.S. President,0,,1/27/20,2020-02-02,,,False,,,False,False,2/3/20 13:37,,https://morningconsult.com/2020-democratic-primary/,general,Trump,Donald Trump,REP,42.0,2020-02-03,2020-01-27,2020-02-02,42.0,0.0,46.0,NO,0.5227272727272729,4.0,NA,National,Online
82,116517,63433,2020,National,1189,Morning Consult,,,Morning Consult,218,Morning Consult,B/C,7178.0,rv,rv,Online,U.S. President,0,,1/27/20,2020-02-02,,,False,,,False,False,2/3/20 13:37,,https://morningconsult.com/2020-democratic-primary/,general,Sanders,Bernie Sanders,DEM,46.0,2020-02-03,2020-01-27,2020-02-02,46.0,0.0,46.0,YES,0.5227272727272729,4.0,NA,National,Online
83,116517,63433,2020,National,1189,Morning Consult,,,Morning Consult,218,Morning Consult,B/C,7178.0,rv,rv,Online,U.S. President,0,,1/27/20,2020-02-02,,,False,,,False,False,2/3/20 13:37,,https://morningconsult.com/2020-democratic-primary/,general,Trump,Donald Trump,REP,42.0,2020-02-03,2020-01-27,2020-02-02,42.0,0.0,46.0,NO,0.5227272727272729,4.0,NA,National,Online
84,116518,63433,2020,National,1189,Morning Consult,,,Morning Consult,218,Morning Consult,B/C,7178.0,rv,rv,Online,U.S. President,0,,1/27/20,2020-02-02,,,False,,,False,False,2/3/20 13:37,,https://morningconsult.com/2020-democratic-primary/,general,Warren,Elizabeth Warren,DEM,43.0,2020-02-03,2020-01-27,2020-02-02,43.0,0.0,43.0,YES,0.505882352941176,1.0,NA,National,Online
85,116518,63433,2020,National,1189,Morning Consult,,,Morning Consult,218,Morning Consult,B/C,7178.0,rv,rv,Online,U.S. President,0,,1/27/20,2020-02-02,,,False,,,False,False,2/3/20 13:37,,https://morningconsult.com/2020-democratic-primary/,general,Trump,Donald Trump,REP,42.0,2020-02-03,2020-01-27,2020-02-02,42.0,0.0,43.0,NO,0.505882352941176,1.0,NA,National,Online
86,116519,63433,2020,National,1189,Morning Consult,,,Morning Consult,218,Morning Consult,B/C,7178.0,rv,rv,Online,U.S. President,0,,1/27/20,2020-02-02,,,False,,,False,False,2/3/20 13:37,,https://morningconsult.com/2020-democratic-primary/,general,Buttigieg,Pete Buttigieg,DEM,42.0,2020-02-03,2020-01-27,2020-02-02,42.0,0.0,42.0,YES,0.5060240963855421,1.0,NA,National,Online
87,116519,63433,2020,National,1189,Morning Consult,,,Morning Consult,218,Morning Consult,B/C,7178.0,rv,rv,Online,U.S. President,0,,1/27/20,2020-02-02,,,False,,,False,False,2/3/20 13:37,,https://morningconsult.com/2020-democratic-primary/,general,Trump,Donald Trump,REP,41.0,2020-02-03,2020-01-27,2020-02-02,41.0,0.0,42.0,NO,0.5060240963855421,1.0,NA,National,Online
88,116658,63466,2020,North Dakota,788,DFM Research,,,DFM Research,69,DFM Research,B/C,600.0,a,a,Live Phone,U.S. President,0,,1/28/20,2020-02-01,,,False,,,False,False,2/6/20 13:06,,https://www.scribd.com/document/445899431/DFM-Polling-Memo,general,Biden,Joe Biden,DEM,34.0,2020-02-06,2020-01-28,2020-02-01,34.0,0.0,59.0,NO,0.36559139784946204,-25.0,ND,Midwest,Phone
89,116658,63466,2020,North Dakota,788,DFM Research,,,DFM Research,69,DFM Research,B/C,600.0,a,a,Live Phone,U.S. President,0,,1/28/20,2020-02-01,,,False,,,False,False,2/6/20 13:06,,https://www.scribd.com/document/445899431/DFM-Polling-Memo,general,Trump,Donald Trump,REP,59.0,2020-02-06,2020-01-28,2020-02-01,59.0,0.0,59.0,YES,0.36559139784946204,-25.0,ND,Midwest,Phone
90,116659,63466,2020,North Dakota,788,DFM Research,,,DFM Research,69,DFM Research,B/C,600.0,a,a,Live Phone,U.S. President,0,,1/28/20,2020-02-01,,,False,,,False,False,2/6/20 13:06,,https://www.scribd.com/document/445899431/DFM-Polling-Memo,general,Sanders,Bernie Sanders,DEM,32.0,2020-02-06,2020-01-28,2020-02-01,32.0,0.0,61.0,NO,0.34408602150537604,-29.0,ND,Midwest,Phone
91,116659,63466,2020,North Dakota,788,DFM Research,,,DFM Research,69,DFM Research,B/C,600.0,a,a,Live Phone,U.S. President,0,,1/28/20,2020-02-01,,,False,,,False,False,2/6/20 13:06,,https://www.scribd.com/document/445899431/DFM-Polling-Memo,general,Trump,Donald Trump,REP,61.0,2020-02-06,2020-01-28,2020-02-01,61.0,0.0,61.0,YES,0.34408602150537604,-29.0,ND,Midwest,Phone
92,116660,63466,2020,North Dakota,788,DFM Research,,,DFM Research,69,DFM Research,B/C,600.0,a,a,Live Phone,U.S. President,0,,1/28/20,2020-02-01,,,False,,,False,False,2/6/20 13:06,,https://www.scribd.com/document/445899431/DFM-Polling-Memo,general,Klobuchar,Amy Klobuchar,DEM,33.0,2020-02-06,2020-01-28,2020-02-01,33.0,0.0,59.0,NO,0.35869565217391297,-26.0,ND,Midwest,Phone
93,116660,63466,2020,North Dakota,788,DFM Research,,,DFM Research,69,DFM Research,B/C,600.0,a,a,Live Phone,U.S. President,0,,1/28/20,2020-02-01,,,False,,,False,False,2/6/20 13:06,,https://www.scribd.com/document/445899431/DFM-Polling-Memo,general,Trump,Donald Trump,REP,59.0,2020-02-06,2020-01-28,2020-02-01,59.0,0.0,59.0,YES,0.35869565217391297,-26.0,ND,Midwest,Phone
94,116661,63466,2020,North Dakota,788,DFM Research,,,DFM Research,69,DFM Research,B/C,600.0,a,a,Live Phone,U.S. President,0,,1/28/20,2020-02-01,,,False,,,False,False,2/6/20 13:06,,https://www.scribd.com/document/445899431/DFM-Polling-Memo,general,Trump,Donald Trump,REP,59.0,2020-02-06,2020-01-28,2020-02-01,59.0,0.0,59.0,YES,0.351648351648352,-27.0,ND,Midwest,Phone
95,116662,63466,2020,North Dakota,788,DFM Research,,,DFM Research,69,DFM Research,B/C,600.0,a,a,Live Phone,U.S. President,0,,1/28/20,2020-02-01,,,False,,,False,False,2/6/20 13:07,,https://www.scribd.com/document/445899431/DFM-Polling-Memo,general,Warren,Elizabeth Warren,DEM,31.0,2020-02-06,2020-01-28,2020-02-01,31.0,0.0,62.0,NO,0.33333333333333304,-31.0,ND,Midwest,Phone
96,116662,63466,2020,North Dakota,788,DFM Research,,,DFM Research,69,DFM Research,B/C,600.0,a,a,Live Phone,U.S. President,0,,1/28/20,2020-02-01,,,False,,,False,False,2/6/20 13:07,,https://www.scribd.com/document/445899431/DFM-Polling-Memo,general,Trump,Donald Trump,REP,62.0,2020-02-06,2020-01-28,2020-02-01,62.0,0.0,62.0,YES,0.33333333333333304,-31.0,ND,Midwest,Phone
97,116663,63466,2020,North Dakota,788,DFM Research,,,DFM Research,69,DFM Research,B/C,600.0,a,a,Live Phone,U.S. President,0,,1/28/20,2020-02-01,,,False,,,False,False,2/6/20 13:07,,https://www.scribd.com/document/445899431/DFM-Polling-Memo,general,Buttigieg,Pete Buttigieg,DEM,31.0,2020-02-06,2020-01-28,2020-02-01,31.0,0.0,59.0,NO,0.34444444444444394,-28.0,ND,Midwest,Phone
98,116663,63466,2020,North Dakota,788,DFM Research,,,DFM Research,69,DFM Research,B/C,600.0,a,a,Live Phone,U.S. President,0,,1/28/20,2020-02-01,,,False,,,False,False,2/6/20 13:07,,https://www.scribd.com/document/445899431/DFM-Polling-Memo,general,Trump,Donald Trump,REP,59.0,2020-02-06,2020-01-28,2020-02-01,59.0,0.0,59.0,YES,0.34444444444444394,-28.0,ND,Midwest,Phone
99,116664,63466,2020,North Dakota,788,DFM Research,,,DFM Research,69,DFM Research,B/C,,lv,lv,Live Phone,U.S. President,0,,1/28/20,2020-02-01,,,False,,,False,False,2/6/20 13:07,,https://www.scribd.com/document/445899431/DFM-Polling-Memo,general,Biden,Joe Biden,DEM,38.0,2020-02-06,2020-01-28,2020-02-01,38.0,0.0,57.0,NO,0.4,-19.0,ND,Midwest,Phone
100,116664,63466,2020,North Dakota,788,DFM Research,,,DFM Research,69,DFM Research,B/C,,lv,lv,Live Phone,U.S. President,0,,1/28/20,2020-02-01,,,False,,,False,False,2/6/20 13:07,,https://www.scribd.com/document/445899431/DFM-Polling-Memo,general,Trump,Donald Trump,REP,57.0,2020-02-06,2020-01-28,2020-02-01,57.0,0.0,57.0,YES,0.4,-19.0,ND,Midwest,Phone
101,116665,63466,2020,North Dakota,788,DFM Research,,,DFM Research,69,DFM Research,B/C,,lv,lv,Live Phone,U.S. President,0,,1/28/20,2020-02-01,,,False,,,False,False,2/6/20 13:07,,https://www.scribd.com/document/445899431/DFM-Polling-Memo,general,Sanders,Bernie Sanders,DEM,35.0,2020-02-06,2020-01-28,2020-02-01,35.0,0.0,60.0,NO,0.368421052631579,-25.0,ND,Midwest,Phone
102,116665,63466,2020,North Dakota,788,DFM Research,,,DFM Research,69,DFM Research,B/C,,lv,lv,Live Phone,U.S. President,0,,1/28/20,2020-02-01,,,False,,,False,False,2/6/20 13:07,,https://www.scribd.com/document/445899431/DFM-Polling-Memo,general,Trump,Donald Trump,REP,60.0,2020-02-06,2020-01-28,2020-02-01,60.0,0.0,60.0,YES,0.368421052631579,-25.0,ND,Midwest,Phone
103,116666,63466,2020,North Dakota,788,DFM Research,,,DFM Research,69,DFM Research,B/C,,lv,lv,Live Phone,U.S. President,0,,1/28/20,2020-02-01,,,False,,,False,False,2/6/20 13:07,,https://www.scribd.com/document/445899431/DFM-Polling-Memo,general,Klobuchar,Amy Klobuchar,DEM,36.0,2020-02-06,2020-01-28,2020-02-01,36.0,0.0,57.0,NO,0.387096774193548,-21.0,ND,Midwest,Phone
104,116666,63466,2020,North Dakota,788,DFM Research,,,DFM Research,69,DFM Research,B/C,,lv,lv,Live Phone,U.S. President,0,,1/28/20,2020-02-01,,,False,,,False,False,2/6/20 13:07,,https://www.scribd.com/document/445899431/DFM-Polling-Memo,general,Trump,Donald Trump,REP,57.0,2020-02-06,2020-01-28,2020-02-01,57.0,0.0,57.0,YES,0.387096774193548,-21.0,ND,Midwest,Phone
105,116667,63466,2020,North Dakota,788,DFM Research,,,DFM Research,69,DFM Research,B/C,,lv,lv,Live Phone,U.S. President,0,,1/28/20,2020-02-01,,,False,,,False,False,2/6/20 13:07,,https://www.scribd.com/document/445899431/DFM-Polling-Memo,general,Trump,Donald Trump,REP,56.0,2020-02-06,2020-01-28,2020-02-01,56.0,0.0,56.0,YES,0.39130434782608703,-20.0,ND,Midwest,Phone
106,116668,63466,2020,North Dakota,788,DFM Research,,,DFM Research,69,DFM Research,B/C,,lv,lv,Live Phone,U.S. President,0,,1/28/20,2020-02-01,,,False,,,False,False,2/6/20 13:07,,https://www.scribd.com/document/445899431/DFM-Polling-Memo,general,Warren,Elizabeth Warren,DEM,34.0,2020-02-06,2020-01-28,2020-02-01,34.0,0.0,59.0,NO,0.36559139784946204,-25.0,ND,Midwest,Phone
107,116668,63466,2020,North Dakota,788,DFM Research,,,DFM Research,69,DFM Research,B/C,,lv,lv,Live Phone,U.S. President,0,,1/28/20,2020-02-01,,,False,,,False,False,2/6/20 13:07,,https://www.scribd.com/document/445899431/DFM-Polling-Memo,general,Trump,Donald Trump,REP,59.0,2020-02-06,2020-01-28,2020-02-01,59.0,0.0,59.0,YES,0.36559139784946204,-25.0,ND,Midwest,Phone
108,116669,63466,2020,North Dakota,788,DFM Research,,,DFM Research,69,DFM Research,B/C,,lv,lv,Live Phone,U.S. President,0,,1/28/20,2020-02-01,,,False,,,False,False,2/6/20 13:07,,https://www.scribd.com/document/445899431/DFM-Polling-Memo,general,Buttigieg,Pete Buttigieg,DEM,34.0,2020-02-06,2020-01-28,2020-02-01,34.0,0.0,57.0,NO,0.3736263736263739,-23.0,ND,Midwest,Phone
109,116669,63466,2020,North Dakota,788,DFM Research,,,DFM Research,69,DFM Research,B/C,,lv,lv,Live Phone,U.S. President,0,,1/28/20,2020-02-01,,,False,,,False,False,2/6/20 13:07,,https://www.scribd.com/document/445899431/DFM-Polling-Memo,general,Trump,Donald Trump,REP,57.0,2020-02-06,2020-01-28,2020-02-01,57.0,0.0,57.0,YES,0.3736263736263739,-23.0,ND,Midwest,Phone
110,116650,63464,2020,Tennessee,289,Mason-Dixon Polling & Research Inc.,,,Mason-Dixon Polling & Research Inc.,197,Mason-Dixon Polling & Research Inc.,B+,625.0,rv,rv,Live Phone,U.S. President,0,,1/28/20,2020-01-30,,,False,,,False,False,2/6/20 12:25,,https://www.realclearpolitics.com/docs/2020/TNPoll120Part2.pdf,general,Biden,Joe Biden,DEM,39.0,2020-02-06,2020-01-28,2020-01-30,39.0,0.0,55.0,NO,0.41489361702127703,-16.0,TN,South,Phone
111,116650,63464,2020,Tennessee,289,Mason-Dixon Polling & Research Inc.,,,Mason-Dixon Polling & Research Inc.,197,Mason-Dixon Polling & Research Inc.,B+,625.0,rv,rv,Live Phone,U.S. President,0,,1/28/20,2020-01-30,,,False,,,False,False,2/6/20 12:25,,https://www.realclearpolitics.com/docs/2020/TNPoll120Part2.pdf,general,Trump,Donald Trump,REP,55.0,2020-02-06,2020-01-28,2020-01-30,55.0,0.0,55.0,YES,0.41489361702127703,-16.0,TN,South,Phone
112,116651,63464,2020,Tennessee,289,Mason-Dixon Polling & Research Inc.,,,Mason-Dixon Polling & Research Inc.,197,Mason-Dixon Polling & Research Inc.,B+,625.0,rv,rv,Live Phone,U.S. President,0,,1/28/20,2020-01-30,,,False,,,False,False,2/6/20 12:25,,https://www.realclearpolitics.com/docs/2020/TNPoll120Part2.pdf,general,Sanders,Bernie Sanders,DEM,37.0,2020-02-06,2020-01-28,2020-01-30,37.0,0.0,57.0,NO,0.39361702127659604,-20.0,TN,South,Phone
113,116651,63464,2020,Tennessee,289,Mason-Dixon Polling & Research Inc.,,,Mason-Dixon Polling & Research Inc.,197,Mason-Dixon Polling & Research Inc.,B+,625.0,rv,rv,Live Phone,U.S. President,0,,1/28/20,2020-01-30,,,False,,,False,False,2/6/20 12:25,,https://www.realclearpolitics.com/docs/2020/TNPoll120Part2.pdf,general,Trump,Donald Trump,REP,57.0,2020-02-06,2020-01-28,2020-01-30,57.0,0.0,57.0,YES,0.39361702127659604,-20.0,TN,South,Phone
114,116652,63464,2020,Tennessee,289,Mason-Dixon Polling & Research Inc.,,,Mason-Dixon Polling & Research Inc.,197,Mason-Dixon Polling & Research Inc.,B+,625.0,rv,rv,Live Phone,U.S. President,0,,1/28/20,2020-01-30,,,False,,,False,False,2/6/20 12:25,,https://www.realclearpolitics.com/docs/2020/TNPoll120Part2.pdf,general,Warren,Elizabeth Warren,DEM,36.0,2020-02-06,2020-01-28,2020-01-30,36.0,0.0,57.0,NO,0.387096774193548,-21.0,TN,South,Phone
115,116652,63464,2020,Tennessee,289,Mason-Dixon Polling & Research Inc.,,,Mason-Dixon Polling & Research Inc.,197,Mason-Dixon Polling & Research Inc.,B+,625.0,rv,rv,Live Phone,U.S. President,0,,1/28/20,2020-01-30,,,False,,,False,False,2/6/20 12:25,,https://www.realclearpolitics.com/docs/2020/TNPoll120Part2.pdf,general,Trump,Donald Trump,REP,57.0,2020-02-06,2020-01-28,2020-01-30,57.0,0.0,57.0,YES,0.387096774193548,-21.0,TN,South,Phone
116,116653,63464,2020,Tennessee,289,Mason-Dixon Polling & Research Inc.,,,Mason-Dixon Polling & Research Inc.,197,Mason-Dixon Polling & Research Inc.,B+,625.0,rv,rv,Live Phone,U.S. President,0,,1/28/20,2020-01-30,,,False,,,False,False,2/6/20 12:25,,https://www.realclearpolitics.com/docs/2020/TNPoll120Part2.pdf,general,Buttigieg,Pete Buttigieg,DEM,38.0,2020-02-06,2020-01-28,2020-01-30,38.0,0.0,55.0,NO,0.408602150537634,-17.0,TN,South,Phone
117,116653,63464,2020,Tennessee,289,Mason-Dixon Polling & Research Inc.,,,Mason-Dixon Polling & Research Inc.,197,Mason-Dixon Polling & Research Inc.,B+,625.0,rv,rv,Live Phone,U.S. President,0,,1/28/20,2020-01-30,,,False,,,False,False,2/6/20 12:25,,https://www.realclearpolitics.com/docs/2020/TNPoll120Part2.pdf,general,Trump,Donald Trump,REP,55.0,2020-02-06,2020-01-28,2020-01-30,55.0,0.0,55.0,YES,0.408602150537634,-17.0,TN,South,Phone
118,116654,63464,2020,Tennessee,289,Mason-Dixon Polling & Research Inc.,,,Mason-Dixon Polling & Research Inc.,197,Mason-Dixon Polling & Research Inc.,B+,625.0,rv,rv,Live Phone,U.S. President,0,,1/28/20,2020-01-30,,,False,,,False,False,2/6/20 12:25,,https://www.realclearpolitics.com/docs/2020/TNPoll120Part2.pdf,general,Trump,Donald Trump,REP,54.0,2020-02-06,2020-01-28,2020-01-30,54.0,0.0,54.0,YES,0.419354838709677,-15.0,TN,South,Phone
119,116429,63412,2020,National,228,IBD/TIPP,,,IBD/TIPP,144,IBD/TIPP,A/B,856.0,rv,rv,Live Phone,U.S. President,0,,1/23/20,2020-01-30,,,False,,,False,False,1/31/20 09:38,,https://projects.fivethirtyeight.com/polls/20190131_National.xlsx,general,Biden,Joe Biden,DEM,49.0,2020-01-31,2020-01-23,2020-01-30,49.0,0.0,49.0,YES,0.5051546391752579,1.0,NA,National,Phone
120,116429,63412,2020,National,228,IBD/TIPP,,,IBD/TIPP,144,IBD/TIPP,A/B,856.0,rv,rv,Live Phone,U.S. President,0,,1/23/20,2020-01-30,,,False,,,False,False,1/31/20 09:38,,https://projects.fivethirtyeight.com/polls/20190131_National.xlsx,general,Trump,Donald Trump,REP,48.0,2020-01-31,2020-01-23,2020-01-30,48.0,0.0,49.0,NO,0.5051546391752579,1.0,NA,National,Phone
121,116430,63412,2020,National,228,IBD/TIPP,,,IBD/TIPP,144,IBD/TIPP,A/B,856.0,rv,rv,Live Phone,U.S. President,0,,1/23/20,2020-01-30,,,False,,,False,False,1/31/20 09:38,,https://projects.fivethirtyeight.com/polls/20190131_National.xlsx,general,Sanders,Bernie Sanders,DEM,47.0,2020-01-31,2020-01-23,2020-01-30,47.0,0.0,49.0,NO,0.4895833333333329,-2.0,NA,National,Phone
122,116430,63412,2020,National,228,IBD/TIPP,,,IBD/TIPP,144,IBD/TIPP,A/B,856.0,rv,rv,Live Phone,U.S. President,0,,1/23/20,2020-01-30,,,False,,,False,False,1/31/20 09:38,,https://projects.fivethirtyeight.com/polls/20190131_National.xlsx,general,Trump,Donald Trump,REP,49.0,2020-01-31,2020-01-23,2020-01-30,49.0,0.0,49.0,YES,0.4895833333333329,-2.0,NA,National,Phone
123,116431,63412,2020,National,228,IBD/TIPP,,,IBD/TIPP,144,IBD/TIPP,A/B,856.0,rv,rv,Live Phone,U.S. President,0,,1/23/20,2020-01-30,,,False,,,False,False,1/31/20 09:38,,https://projects.fivethirtyeight.com/polls/20190131_National.xlsx,general,Warren,Elizabeth Warren,DEM,46.0,2020-01-31,2020-01-23,2020-01-30,46.0,0.0,50.0,NO,0.4791666666666671,-4.0,NA,National,Phone
124,116431,63412,2020,National,228,IBD/TIPP,,,IBD/TIPP,144,IBD/TIPP,A/B,856.0,rv,rv,Live Phone,U.S. President,0,,1/23/20,2020-01-30,,,False,,,False,False,1/31/20 09:38,,https://projects.fivethirtyeight.com/polls/20190131_National.xlsx,general,Trump,Donald Trump,REP,50.0,2020-01-31,2020-01-23,2020-01-30,50.0,0.0,50.0,YES,0.4791666666666671,-4.0,NA,National,Phone
125,116432,63412,2020,National,228,IBD/TIPP,,,IBD/TIPP,144,IBD/TIPP,A/B,856.0,rv,rv,Live Phone,U.S. President,0,,1/23/20,2020-01-30,,,False,,,False,False,1/31/20 09:38,,https://projects.fivethirtyeight.com/polls/20190131_National.xlsx,general,Buttigieg,Pete Buttigieg,DEM,45.0,2020-01-31,2020-01-23,2020-01-30,45.0,0.0,48.0,NO,0.48387096774193505,-3.0,NA,National,Phone
126,116432,63412,2020,National,228,IBD/TIPP,,,IBD/TIPP,144,IBD/TIPP,A/B,856.0,rv,rv,Live Phone,U.S. President,0,,1/23/20,2020-01-30,,,False,,,False,False,1/31/20 09:38,,https://projects.fivethirtyeight.com/polls/20190131_National.xlsx,general,Trump,Donald Trump,REP,48.0,2020-01-31,2020-01-23,2020-01-30,48.0,0.0,48.0,YES,0.48387096774193505,-3.0,NA,National,Phone
127,116433,63412,2020,National,228,IBD/TIPP,,,IBD/TIPP,144,IBD/TIPP,A/B,856.0,rv,rv,Live Phone,U.S. President,0,,1/23/20,2020-01-30,,,False,,,False,False,1/31/20 09:38,,https://projects.fivethirtyeight.com/polls/20190131_National.xlsx,general,Trump,Donald Trump,REP,47.0,2020-01-31,2020-01-23,2020-01-30,47.0,0.0,48.0,NO,0.5052631578947371,1.0,NA,National,Phone
128,116462,63422,2020,Texas,1474,University of Texas at Tyler,1164,Dallas Morning News,University of Texas at Tyler,458,University of Texas at Tyler,B/C,1169.0,rv,rv,Live Phone/Online,U.S. President,0,,1/21/20,2020-01-30,,,False,,,False,False,2/2/20 08:21,,https://projects.fivethirtyeight.com/polls/20200202_TX_1.pdf,general,Warren,Elizabeth Warren,DEM,37.0,2020-02-02,2020-01-21,2020-01-30,37.0,0.0,46.0,NO,0.44578313253012003,-9.0,TX,West,Hybrid
129,116462,63422,2020,Texas,1474,University of Texas at Tyler,1164,Dallas Morning News,University of Texas at Tyler,458,University of Texas at Tyler,B/C,1169.0,rv,rv,Live Phone/Online,U.S. President,0,,1/21/20,2020-01-30,,,False,,,False,False,2/2/20 08:21,,https://projects.fivethirtyeight.com/polls/20200202_TX_1.pdf,general,Trump,Donald Trump,REP,46.0,2020-02-02,2020-01-21,2020-01-30,46.0,0.0,46.0,YES,0.44578313253012003,-9.0,TX,West,Hybrid
130,116463,63422,2020,Texas,1474,University of Texas at Tyler,1164,Dallas Morning News,University of Texas at Tyler,458,University of Texas at Tyler,B/C,1169.0,rv,rv,Live Phone/Online,U.S. President,0,,1/21/20,2020-01-30,,,False,,,False,False,2/2/20 08:21,,https://projects.fivethirtyeight.com/polls/20200202_TX_1.pdf,general,Biden,Joe Biden,DEM,42.0,2020-02-02,2020-01-21,2020-01-30,42.0,0.0,44.0,NO,0.48837209302325607,-2.0,TX,West,Hybrid
131,116463,63422,2020,Texas,1474,University of Texas at Tyler,1164,Dallas Morning News,University of Texas at Tyler,458,University of Texas at Tyler,B/C,1169.0,rv,rv,Live Phone/Online,U.S. President,0,,1/21/20,2020-01-30,,,False,,,False,False,2/2/20 08:21,,https://projects.fivethirtyeight.com/polls/20200202_TX_1.pdf,general,Trump,Donald Trump,REP,44.0,2020-02-02,2020-01-21,2020-01-30,44.0,0.0,44.0,YES,0.48837209302325607,-2.0,TX,West,Hybrid
132,116464,63422,2020,Texas,1474,University of Texas at Tyler,1164,Dallas Morning News,University of Texas at Tyler,458,University of Texas at Tyler,B/C,1169.0,rv,rv,Live Phone/Online,U.S. President,0,,1/21/20,2020-01-30,,,False,,,False,False,2/2/20 08:21,,https://projects.fivethirtyeight.com/polls/20200202_TX_1.pdf,general,Trump,Donald Trump,REP,45.0,2020-02-02,2020-01-21,2020-01-30,45.0,0.0,45.0,YES,0.482758620689655,-3.0,TX,West,Hybrid
133,116465,63422,2020,Texas,1474,University of Texas at Tyler,1164,Dallas Morning News,University of Texas at Tyler,458,University of Texas at Tyler,B/C,1169.0,rv,rv,Live Phone/Online,U.S. President,0,,1/21/20,2020-01-30,,,False,,,False,False,2/2/20 08:21,,https://projects.fivethirtyeight.com/polls/20200202_TX_1.pdf,general,Sanders,Bernie Sanders,DEM,39.0,2020-02-02,2020-01-21,2020-01-30,39.0,0.0,45.0,NO,0.46428571428571397,-6.0,TX,West,Hybrid
134,116465,63422,2020,Texas,1474,University of Texas at Tyler,1164,Dallas Morning News,University of Texas at Tyler,458,University of Texas at Tyler,B/C,1169.0,rv,rv,Live Phone/Online,U.S. President,0,,1/21/20,2020-01-30,,,False,,,False,False,2/2/20 08:21,,https://projects.fivethirtyeight.com/polls/20200202_TX_1.pdf,general,Trump,Donald Trump,REP,45.0,2020-02-02,2020-01-21,2020-01-30,45.0,0.0,45.0,YES,0.46428571428571397,-6.0,TX,West,Hybrid
135,116466,63422,2020,Texas,1474,University of Texas at Tyler,1164,Dallas Morning News,University of Texas at Tyler,458,University of Texas at Tyler,B/C,1169.0,rv,rv,Live Phone/Online,U.S. President,0,,1/21/20,2020-01-30,,,False,,,False,False,2/2/20 08:21,,https://projects.fivethirtyeight.com/polls/20200202_TX_1.pdf,general,Buttigieg,Pete Buttigieg,DEM,34.0,2020-02-02,2020-01-21,2020-01-30,34.0,0.0,46.0,NO,0.425,-12.0,TX,West,Hybrid
136,116466,63422,2020,Texas,1474,University of Texas at Tyler,1164,Dallas Morning News,University of Texas at Tyler,458,University of Texas at Tyler,B/C,1169.0,rv,rv,Live Phone/Online,U.S. President,0,,1/21/20,2020-01-30,,,False,,,False,False,2/2/20 08:21,,https://projects.fivethirtyeight.com/polls/20200202_TX_1.pdf,general,Trump,Donald Trump,REP,46.0,2020-02-02,2020-01-21,2020-01-30,46.0,0.0,46.0,YES,0.425,-12.0,TX,West,Hybrid
137,116467,63422,2020,Texas,1474,University of Texas at Tyler,1164,Dallas Morning News,University of Texas at Tyler,458,University of Texas at Tyler,B/C,1169.0,rv,rv,Live Phone/Online,U.S. President,0,,1/21/20,2020-01-30,,,False,,,False,False,2/2/20 08:21,,https://projects.fivethirtyeight.com/polls/20200202_TX_1.pdf,general,Klobuchar,Amy Klobuchar,DEM,35.0,2020-02-02,2020-01-21,2020-01-30,35.0,0.0,45.0,NO,0.4375,-10.0,TX,West,Hybrid
138,116467,63422,2020,Texas,1474,University of Texas at Tyler,1164,Dallas Morning News,University of Texas at Tyler,458,University of Texas at Tyler,B/C,1169.0,rv,rv,Live Phone/Online,U.S. President,0,,1/21/20,2020-01-30,,,False,,,False,False,2/2/20 08:21,,https://projects.fivethirtyeight.com/polls/20200202_TX_1.pdf,general,Trump,Donald Trump,REP,45.0,2020-02-02,2020-01-21,2020-01-30,45.0,0.0,45.0,YES,0.4375,-10.0,TX,West,Hybrid
139,116468,63422,2020,Texas,1474,University of Texas at Tyler,1164,Dallas Morning News,University of Texas at Tyler,458,University of Texas at Tyler,B/C,1169.0,rv,rv,Live Phone/Online,U.S. President,0,,1/21/20,2020-01-30,,,False,,,False,False,2/2/20 08:21,,https://projects.fivethirtyeight.com/polls/20200202_TX_1.pdf,general,Trump,Donald Trump,REP,46.0,2020-02-02,2020-01-21,2020-01-30,46.0,0.0,46.0,YES,0.41025641025640996,-14.0,TX,West,Hybrid
140,116469,63422,2020,Texas,1474,University of Texas at Tyler,1164,Dallas Morning News,University of Texas at Tyler,458,University of Texas at Tyler,B/C,915.0,lv,lv,Live Phone/Online,U.S. President,0,,1/21/20,2020-01-30,,,False,,,False,False,2/2/20 08:21,,https://projects.fivethirtyeight.com/polls/20200202_TX_3.pdf,general,Warren,Elizabeth Warren,DEM,41.0,2020-02-02,2020-01-21,2020-01-30,41.0,0.0,48.0,NO,0.4606741573033711,-7.0,TX,West,Hybrid
141,116469,63422,2020,Texas,1474,University of Texas at Tyler,1164,Dallas Morning News,University of Texas at Tyler,458,University of Texas at Tyler,B/C,915.0,lv,lv,Live Phone/Online,U.S. President,0,,1/21/20,2020-01-30,,,False,,,False,False,2/2/20 08:21,,https://projects.fivethirtyeight.com/polls/20200202_TX_3.pdf,general,Trump,Donald Trump,REP,48.0,2020-02-02,2020-01-21,2020-01-30,48.0,0.0,48.0,YES,0.4606741573033711,-7.0,TX,West,Hybrid
142,116470,63422,2020,Texas,1474,University of Texas at Tyler,1164,Dallas Morning News,University of Texas at Tyler,458,University of Texas at Tyler,B/C,915.0,lv,lv,Live Phone/Online,U.S. President,0,,1/21/20,2020-01-30,,,False,,,False,False,2/2/20 08:21,,https://projects.fivethirtyeight.com/polls/20200202_TX_3.pdf,general,Biden,Joe Biden,DEM,44.0,2020-02-02,2020-01-21,2020-01-30,44.0,0.0,46.0,NO,0.48888888888888893,-2.0,TX,West,Hybrid
143,116470,63422,2020,Texas,1474,University of Texas at Tyler,1164,Dallas Morning News,University of Texas at Tyler,458,University of Texas at Tyler,B/C,915.0,lv,lv,Live Phone/Online,U.S. President,0,,1/21/20,2020-01-30,,,False,,,False,False,2/2/20 08:21,,https://projects.fivethirtyeight.com/polls/20200202_TX_3.pdf,general,Trump,Donald Trump,REP,46.0,2020-02-02,2020-01-21,2020-01-30,46.0,0.0,46.0,YES,0.48888888888888893,-2.0,TX,West,Hybrid
144,116471,63422,2020,Texas,1474,University of Texas at Tyler,1164,Dallas Morning News,University of Texas at Tyler,458,University of Texas at Tyler,B/C,915.0,lv,lv,Live Phone/Online,U.S. President,0,,1/21/20,2020-01-30,,,False,,,False,False,2/2/20 08:21,,https://projects.fivethirtyeight.com/polls/20200202_TX_3.pdf,general,Trump,Donald Trump,REP,47.0,2020-02-02,2020-01-21,2020-01-30,47.0,0.0,47.0,YES,0.48351648351648396,-3.0,TX,West,Hybrid
145,116472,63422,2020,Texas,1474,University of Texas at Tyler,1164,Dallas Morning News,University of Texas at Tyler,458,University of Texas at Tyler,B/C,915.0,lv,lv,Live Phone/Online,U.S. President,0,,1/21/20,2020-01-30,,,False,,,False,False,2/2/20 08:21,,https://projects.fivethirtyeight.com/polls/20200202_TX_3.pdf,general,Sanders,Bernie Sanders,DEM,42.0,2020-02-02,2020-01-21,2020-01-30,42.0,0.0,47.0,NO,0.47191011235955105,-5.0,TX,West,Hybrid
146,116472,63422,2020,Texas,1474,University of Texas at Tyler,1164,Dallas Morning News,University of Texas at Tyler,458,University of Texas at Tyler,B/C,915.0,lv,lv,Live Phone/Online,U.S. President,0,,1/21/20,2020-01-30,,,False,,,False,False,2/2/20 08:21,,https://projects.fivethirtyeight.com/polls/20200202_TX_3.pdf,general,Trump,Donald Trump,REP,47.0,2020-02-02,2020-01-21,2020-01-30,47.0,0.0,47.0,YES,0.47191011235955105,-5.0,TX,West,Hybrid
147,116473,63422,2020,Texas,1474,University of Texas at Tyler,1164,Dallas Morning News,University of Texas at Tyler,458,University of Texas at Tyler,B/C,915.0,lv,lv,Live Phone/Online,U.S. President,0,,1/21/20,2020-01-30,,,False,,,False,False,2/2/20 08:21,,https://projects.fivethirtyeight.com/polls/20200202_TX_3.pdf,general,Buttigieg,Pete Buttigieg,DEM,37.0,2020-02-02,2020-01-21,2020-01-30,37.0,0.0,47.0,NO,0.44047619047619,-10.0,TX,West,Hybrid
148,116473,63422,2020,Texas,1474,University of Texas at Tyler,1164,Dallas Morning News,University of Texas at Tyler,458,University of Texas at Tyler,B/C,915.0,lv,lv,Live Phone/Online,U.S. President,0,,1/21/20,2020-01-30,,,False,,,False,False,2/2/20 08:21,,https://projects.fivethirtyeight.com/polls/20200202_TX_3.pdf,general,Trump,Donald Trump,REP,47.0,2020-02-02,2020-01-21,2020-01-30,47.0,0.0,47.0,YES,0.44047619047619,-10.0,TX,West,Hybrid
149,116474,63422,2020,Texas,1474,University of Texas at Tyler,1164,Dallas Morning News,University of Texas at Tyler,458,University of Texas at Tyler,B/C,915.0,lv,lv,Live Phone/Online,U.S. President,0,,1/21/20,2020-01-30,,,False,,,False,False,2/2/20 08:21,,https://projects.fivethirtyeight.com/polls/20200202_TX_3.pdf,general,Klobuchar,Amy Klobuchar,DEM,38.0,2020-02-02,2020-01-21,2020-01-30,38.0,0.0,46.0,NO,0.452380952380952,-8.0,TX,West,Hybrid
150,116474,63422,2020,Texas,1474,University of Texas at Tyler,1164,Dallas Morning News,University of Texas at Tyler,458,University of Texas at Tyler,B/C,915.0,lv,lv,Live Phone/Online,U.S. President,0,,1/21/20,2020-01-30,,,False,,,False,False,2/2/20 08:21,,https://projects.fivethirtyeight.com/polls/20200202_TX_3.pdf,general,Trump,Donald Trump,REP,46.0,2020-02-02,2020-01-21,2020-01-30,46.0,0.0,46.0,YES,0.452380952380952,-8.0,TX,West,Hybrid
151,116475,63422,2020,Texas,1474,University of Texas at Tyler,1164,Dallas Morning News,University of Texas at Tyler,458,University of Texas at Tyler,B/C,915.0,lv,lv,Live Phone/Online,U.S. President,0,,1/21/20,2020-01-30,,,False,,,False,False,2/2/20 08:21,,https://projects.fivethirtyeight.com/polls/20200202_TX_3.pdf,general,Trump,Donald Trump,REP,47.0,2020-02-02,2020-01-21,2020-01-30,47.0,0.0,47.0,YES,0.433734939759036,-11.0,TX,West,Hybrid
152,116478,63407,2020,National,335,NBC News/Wall Street Journal,,,NBC News/Wall Street Journal,221,NBC News/Wall Street Journal,A/B,1000.0,rv,rv,Live Phone,U.S. President,0,,1/26/20,2020-01-29,,,False,,,False,False,2/2/20 09:01,,https://www.nbcnews.com/politics/meet-the-press/nbc-wsj-poll-country-remains-divided-over-trump-s-impeachment-n1128326,general,Biden,Joe Biden,DEM,50.0,2020-02-02,2020-01-26,2020-01-29,50.0,0.0,50.0,YES,0.531914893617021,6.0,NA,National,Phone
153,116478,63407,2020,National,335,NBC News/Wall Street Journal,,,NBC News/Wall Street Journal,221,NBC News/Wall Street Journal,A/B,1000.0,rv,rv,Live Phone,U.S. President,0,,1/26/20,2020-01-29,,,False,,,False,False,2/2/20 09:01,,https://www.nbcnews.com/politics/meet-the-press/nbc-wsj-poll-country-remains-divided-over-trump-s-impeachment-n1128326,general,Trump,Donald Trump,REP,44.0,2020-02-02,2020-01-26,2020-01-29,44.0,0.0,50.0,NO,0.531914893617021,6.0,NA,National,Phone
154,116479,63407,2020,National,335,NBC News/Wall Street Journal,,,NBC News/Wall Street Journal,221,NBC News/Wall Street Journal,A/B,1000.0,rv,rv,Live Phone,U.S. President,0,,1/26/20,2020-01-29,,,False,,,False,False,2/2/20 09:01,,https://www.nbcnews.com/politics/meet-the-press/nbc-wsj-poll-country-remains-divided-over-trump-s-impeachment-n1128326,general,Warren,Elizabeth Warren,DEM,48.0,2020-02-02,2020-01-26,2020-01-29,48.0,0.0,48.0,YES,0.516129032258065,3.0,NA,National,Phone
155,116479,63407,2020,National,335,NBC News/Wall Street Journal,,,NBC News/Wall Street Journal,221,NBC News/Wall Street Journal,A/B,1000.0,rv,rv,Live Phone,U.S. President,0,,1/26/20,2020-01-29,,,False,,,False,False,2/2/20 09:01,,https://www.nbcnews.com/politics/meet-the-press/nbc-wsj-poll-country-remains-divided-over-trump-s-impeachment-n1128326,general,Trump,Donald Trump,REP,45.0,2020-02-02,2020-01-26,2020-01-29,45.0,0.0,48.0,NO,0.516129032258065,3.0,NA,National,Phone
156,116480,63407,2020,National,335,NBC News/Wall Street Journal,,,NBC News/Wall Street Journal,221,NBC News/Wall Street Journal,A/B,1000.0,rv,rv,Live Phone,U.S. President,0,,1/26/20,2020-01-29,,,False,,,False,False,2/2/20 09:01,,https://www.nbcnews.com/politics/meet-the-press/nbc-wsj-poll-country-remains-divided-over-trump-s-impeachment-n1128326,general,Sanders,Bernie Sanders,DEM,49.0,2020-02-02,2020-01-26,2020-01-29,49.0,0.0,49.0,YES,0.5212765957446811,4.0,NA,National,Phone
157,116480,63407,2020,National,335,NBC News/Wall Street Journal,,,NBC News/Wall Street Journal,221,NBC News/Wall Street Journal,A/B,1000.0,rv,rv,Live Phone,U.S. President,0,,1/26/20,2020-01-29,,,False,,,False,False,2/2/20 09:01,,https://www.nbcnews.com/politics/meet-the-press/nbc-wsj-poll-country-remains-divided-over-trump-s-impeachment-n1128326,general,Trump,Donald Trump,REP,45.0,2020-02-02,2020-01-26,2020-01-29,45.0,0.0,49.0,NO,0.5212765957446811,4.0,NA,National,Phone
158,116481,63407,2020,National,335,NBC News/Wall Street Journal,,,NBC News/Wall Street Journal,221,NBC News/Wall Street Journal,A/B,1000.0,rv,rv,Live Phone,U.S. President,0,,1/26/20,2020-01-29,,,False,,,False,False,2/2/20 09:01,,https://www.nbcnews.com/politics/meet-the-press/nbc-wsj-poll-country-remains-divided-over-trump-s-impeachment-n1128326,general,Buttigieg,Pete Buttigieg,DEM,46.0,2020-02-02,2020-01-26,2020-01-29,46.0,0.0,46.0,YES,0.505494505494505,1.0,NA,National,Phone
159,116481,63407,2020,National,335,NBC News/Wall Street Journal,,,NBC News/Wall Street Journal,221,NBC News/Wall Street Journal,A/B,1000.0,rv,rv,Live Phone,U.S. President,0,,1/26/20,2020-01-29,,,False,,,False,False,2/2/20 09:01,,https://www.nbcnews.com/politics/meet-the-press/nbc-wsj-poll-country-remains-divided-over-trump-s-impeachment-n1128326,general,Trump,Donald Trump,REP,45.0,2020-02-02,2020-01-26,2020-01-29,45.0,0.0,46.0,NO,0.505494505494505,1.0,NA,National,Phone
160,116411,63408,2020,National,1300,USC Dornsife/LA Times,,,USC Dornsife/LA Times,343,USC Dornsife/LA Times,B/C,4869.0,rv,rv,Online,U.S. President,0,,1/15/20,2020-01-28,,,False,,,False,False,1/31/20 07:00,,https://drive.google.com/file/d/1_JsEQQbLSxwYLJE-JtvQ-syrSuwU4YN9/view,general,Biden,Joe Biden,DEM,49.0,2020-01-31,2020-01-15,2020-01-28,49.0,0.0,49.0,YES,0.5505617977528089,9.0,NA,National,Online
161,116411,63408,2020,National,1300,USC Dornsife/LA Times,,,USC Dornsife/LA Times,343,USC Dornsife/LA Times,B/C,4869.0,rv,rv,Online,U.S. President,0,,1/15/20,2020-01-28,,,False,,,False,False,1/31/20 07:00,,https://drive.google.com/file/d/1_JsEQQbLSxwYLJE-JtvQ-syrSuwU4YN9/view,general,Trump,Donald Trump,REP,40.0,2020-01-31,2020-01-15,2020-01-28,40.0,0.0,49.0,NO,0.5505617977528089,9.0,NA,National,Online
162,116412,63408,2020,National,1300,USC Dornsife/LA Times,,,USC Dornsife/LA Times,343,USC Dornsife/LA Times,B/C,4869.0,rv,rv,Online,U.S. President,0,,1/15/20,2020-01-28,,,False,,,False,False,1/31/20 07:00,,https://drive.google.com/file/d/1_JsEQQbLSxwYLJE-JtvQ-syrSuwU4YN9/view,general,Sanders,Bernie Sanders,DEM,47.0,2020-01-31,2020-01-15,2020-01-28,47.0,0.0,47.0,YES,0.540229885057471,7.0,NA,National,Online
163,116412,63408,2020,National,1300,USC Dornsife/LA Times,,,USC Dornsife/LA Times,343,USC Dornsife/LA Times,B/C,4869.0,rv,rv,Online,U.S. President,0,,1/15/20,2020-01-28,,,False,,,False,False,1/31/20 07:00,,https://drive.google.com/file/d/1_JsEQQbLSxwYLJE-JtvQ-syrSuwU4YN9/view,general,Trump,Donald Trump,REP,40.0,2020-01-31,2020-01-15,2020-01-28,40.0,0.0,47.0,NO,0.540229885057471,7.0,NA,National,Online
164,116413,63408,2020,National,1300,USC Dornsife/LA Times,,,USC Dornsife/LA Times,343,USC Dornsife/LA Times,B/C,4869.0,rv,rv,Online,U.S. President,0,,1/15/20,2020-01-28,,,False,,,False,False,1/31/20 07:00,,https://drive.google.com/file/d/1_JsEQQbLSxwYLJE-JtvQ-syrSuwU4YN9/view,general,Warren,Elizabeth Warren,DEM,45.0,2020-01-31,2020-01-15,2020-01-28,45.0,0.0,45.0,YES,0.523255813953488,4.0,NA,National,Online
165,116413,63408,2020,National,1300,USC Dornsife/LA Times,,,USC Dornsife/LA Times,343,USC Dornsife/LA Times,B/C,4869.0,rv,rv,Online,U.S. President,0,,1/15/20,2020-01-28,,,False,,,False,False,1/31/20 07:00,,https://drive.google.com/file/d/1_JsEQQbLSxwYLJE-JtvQ-syrSuwU4YN9/view,general,Trump,Donald Trump,REP,41.0,2020-01-31,2020-01-15,2020-01-28,41.0,0.0,45.0,NO,0.523255813953488,4.0,NA,National,Online
166,116414,63408,2020,National,1300,USC Dornsife/LA Times,,,USC Dornsife/LA Times,343,USC Dornsife/LA Times,B/C,4869.0,rv,rv,Online,U.S. President,0,,1/15/20,2020-01-28,,,False,,,False,False,1/31/20 07:00,,https://drive.google.com/file/d/1_JsEQQbLSxwYLJE-JtvQ-syrSuwU4YN9/view,general,Buttigieg,Pete Buttigieg,DEM,43.0,2020-01-31,2020-01-15,2020-01-28,43.0,0.0,43.0,YES,0.518072289156627,3.0,NA,National,Online
167,116414,63408,2020,National,1300,USC Dornsife/LA Times,,,USC Dornsife/LA Times,343,USC Dornsife/LA Times,B/C,4869.0,rv,rv,Online,U.S. President,0,,1/15/20,2020-01-28,,,False,,,False,False,1/31/20 07:00,,https://drive.google.com/file/d/1_JsEQQbLSxwYLJE-JtvQ-syrSuwU4YN9/view,general,Trump,Donald Trump,REP,40.0,2020-01-31,2020-01-15,2020-01-28,40.0,0.0,43.0,NO,0.518072289156627,3.0,NA,National,Online
168,116415,63408,2020,National,1300,USC Dornsife/LA Times,,,USC Dornsife/LA Times,343,USC Dornsife/LA Times,B/C,4869.0,rv,rv,Online,U.S. President,0,,1/15/20,2020-01-28,,,False,,,False,False,1/31/20 07:00,,https://drive.google.com/file/d/1_JsEQQbLSxwYLJE-JtvQ-syrSuwU4YN9/view,general,Klobuchar,Amy Klobuchar,DEM,42.0,2020-01-31,2020-01-15,2020-01-28,42.0,0.0,42.0,YES,0.51219512195122,2.0,NA,National,Online
169,116415,63408,2020,National,1300,USC Dornsife/LA Times,,,USC Dornsife/LA Times,343,USC Dornsife/LA Times,B/C,4869.0,rv,rv,Online,U.S. President,0,,1/15/20,2020-01-28,,,False,,,False,False,1/31/20 07:00,,https://drive.google.com/file/d/1_JsEQQbLSxwYLJE-JtvQ-syrSuwU4YN9/view,general,Trump,Donald Trump,REP,40.0,2020-01-31,2020-01-15,2020-01-28,40.0,0.0,42.0,NO,0.51219512195122,2.0,NA,National,Online
170,116201,63366,2020,National,1189,Morning Consult,,,Morning Consult,218,Morning Consult,B/C,8399.0,rv,rv,Online,U.S. President,0,,1/20/20,2020-01-26,,,False,,,False,False,1/28/20 06:21,,https://morningconsult.com/2020-democratic-primary/,general,Biden,Joe Biden,DEM,47.0,2020-01-28,2020-01-20,2020-01-26,47.0,0.0,47.0,YES,0.534090909090909,6.0,NA,National,Online
171,116201,63366,2020,National,1189,Morning Consult,,,Morning Consult,218,Morning Consult,B/C,8399.0,rv,rv,Online,U.S. President,0,,1/20/20,2020-01-26,,,False,,,False,False,1/28/20 06:21,,https://morningconsult.com/2020-democratic-primary/,general,Trump,Donald Trump,REP,41.0,2020-01-28,2020-01-20,2020-01-26,41.0,0.0,47.0,NO,0.534090909090909,6.0,NA,National,Online
172,116202,63366,2020,National,1189,Morning Consult,,,Morning Consult,218,Morning Consult,B/C,8399.0,rv,rv,Online,U.S. President,0,,1/20/20,2020-01-26,,,False,,,False,False,1/28/20 06:21,,https://morningconsult.com/2020-democratic-primary/,general,Sanders,Bernie Sanders,DEM,46.0,2020-01-28,2020-01-20,2020-01-26,46.0,0.0,46.0,YES,0.528735632183908,5.0,NA,National,Online
173,116202,63366,2020,National,1189,Morning Consult,,,Morning Consult,218,Morning Consult,B/C,8399.0,rv,rv,Online,U.S. President,0,,1/20/20,2020-01-26,,,False,,,False,False,1/28/20 06:21,,https://morningconsult.com/2020-democratic-primary/,general,Trump,Donald Trump,REP,41.0,2020-01-28,2020-01-20,2020-01-26,41.0,0.0,46.0,NO,0.528735632183908,5.0,NA,National,Online
174,116203,63366,2020,National,1189,Morning Consult,,,Morning Consult,218,Morning Consult,B/C,8399.0,rv,rv,Online,U.S. President,0,,1/20/20,2020-01-26,,,False,,,False,False,1/28/20 06:21,,https://morningconsult.com/2020-democratic-primary/,general,Trump,Donald Trump,REP,41.0,2020-01-28,2020-01-20,2020-01-26,41.0,0.0,45.0,NO,0.523255813953488,4.0,NA,National,Online
175,116204,63366,2020,National,1189,Morning Consult,,,Morning Consult,218,Morning Consult,B/C,8399.0,rv,rv,Online,U.S. President,0,,1/20/20,2020-01-26,,,False,,,False,False,1/28/20 06:21,,https://morningconsult.com/2020-democratic-primary/,general,Buttigieg,Pete Buttigieg,DEM,43.0,2020-01-28,2020-01-20,2020-01-26,43.0,0.0,43.0,YES,0.511904761904762,2.0,NA,National,Online
176,116204,63366,2020,National,1189,Morning Consult,,,Morning Consult,218,Morning Consult,B/C,8399.0,rv,rv,Online,U.S. President,0,,1/20/20,2020-01-26,,,False,,,False,False,1/28/20 06:21,,https://morningconsult.com/2020-democratic-primary/,general,Trump,Donald Trump,REP,41.0,2020-01-28,2020-01-20,2020-01-26,41.0,0.0,43.0,NO,0.511904761904762,2.0,NA,National,Online
177,116205,63366,2020,National,1189,Morning Consult,,,Morning Consult,218,Morning Consult,B/C,8399.0,rv,rv,Online,U.S. President,0,,1/20/20,2020-01-26,,,False,,,False,False,1/28/20 06:21,,https://morningconsult.com/2020-democratic-primary/,general,Warren,Elizabeth Warren,DEM,43.0,2020-01-28,2020-01-20,2020-01-26,43.0,0.0,43.0,YES,0.5,0.0,NA,National,Online
178,116205,63366,2020,National,1189,Morning Consult,,,Morning Consult,218,Morning Consult,B/C,8399.0,rv,rv,Online,U.S. President,0,,1/20/20,2020-01-26,,,False,,,False,False,1/28/20 06:21,,https://morningconsult.com/2020-democratic-primary/,general,Trump,Donald Trump,REP,43.0,2020-01-28,2020-01-20,2020-01-26,43.0,0.0,43.0,YES,0.5,0.0,NA,National,Online
179,116073,63338,2020,National,1102,Emerson College,43,7News,Emerson College,88,Emerson College,A-,1128.0,rv,rv,IVR/Online,U.S. President,0,,1/21/20,2020-01-23,,,False,,,False,False,1/23/20 21:01,,http://emersonpolling.com/2020/01/24/national-2020-biden-and-sanders-battle-in-two-way-race-for-democratic-nomination/,general,Biden,Joe Biden,DEM,50.4,2020-01-23,2020-01-21,2020-01-23,50.4,0.0,50.4,YES,0.504,0.799999999999997,NA,National,Hybrid
180,116073,63338,2020,National,1102,Emerson College,43,7News,Emerson College,88,Emerson College,A-,1128.0,rv,rv,IVR/Online,U.S. President,0,,1/21/20,2020-01-23,,,False,,,False,False,1/23/20 21:01,,http://emersonpolling.com/2020/01/24/national-2020-biden-and-sanders-battle-in-two-way-race-for-democratic-nomination/,general,Trump,Donald Trump,REP,49.6,2020-01-23,2020-01-21,2020-01-23,49.6,0.0,50.4,NO,0.504,0.799999999999997,NA,National,Hybrid
181,116074,63338,2020,National,1102,Emerson College,43,7News,Emerson College,88,Emerson College,A-,1128.0,rv,rv,IVR/Online,U.S. President,0,,1/21/20,2020-01-23,,,False,,,False,False,1/23/20 21:01,,http://emersonpolling.com/2020/01/24/national-2020-biden-and-sanders-battle-in-two-way-race-for-democratic-nomination/,general,Sanders,Bernie Sanders,DEM,51.4,2020-01-23,2020-01-21,2020-01-23,51.4,0.0,51.4,YES,0.514,2.8,NA,National,Hybrid
182,116074,63338,2020,National,1102,Emerson College,43,7News,Emerson College,88,Emerson College,A-,1128.0,rv,rv,IVR/Online,U.S. President,0,,1/21/20,2020-01-23,,,False,,,False,False,1/23/20 21:01,,http://emersonpolling.com/2020/01/24/national-2020-biden-and-sanders-battle-in-two-way-race-for-democratic-nomination/,general,Trump,Donald Trump,REP,48.6,2020-01-23,2020-01-21,2020-01-23,48.6,0.0,51.4,NO,0.514,2.8,NA,National,Hybrid
183,116075,63338,2020,National,1102,Emerson College,43,7News,Emerson College,88,Emerson College,A-,1128.0,rv,rv,IVR/Online,U.S. President,0,,1/21/20,2020-01-23,,,False,,,False,False,1/23/20 21:01,,http://emersonpolling.com/2020/01/24/national-2020-biden-and-sanders-battle-in-two-way-race-for-democratic-nomination/,general,Warren,Elizabeth Warren,DEM,49.6,2020-01-23,2020-01-21,2020-01-23,49.6,0.0,50.4,NO,0.496,-0.799999999999997,NA,National,Hybrid
184,116075,63338,2020,National,1102,Emerson College,43,7News,Emerson College,88,Emerson College,A-,1128.0,rv,rv,IVR/Online,U.S. President,0,,1/21/20,2020-01-23,,,False,,,False,False,1/23/20 21:01,,http://emersonpolling.com/2020/01/24/national-2020-biden-and-sanders-battle-in-two-way-race-for-democratic-nomination/,general,Trump,Donald Trump,REP,50.4,2020-01-23,2020-01-21,2020-01-23,50.4,0.0,50.4,YES,0.496,-0.799999999999997,NA,National,Hybrid
185,116076,63338,2020,National,1102,Emerson College,43,7News,Emerson College,88,Emerson College,A-,1128.0,rv,rv,IVR/Online,U.S. President,0,,1/21/20,2020-01-23,,,False,,,False,False,1/23/20 21:01,,http://emersonpolling.com/2020/01/24/national-2020-biden-and-sanders-battle-in-two-way-race-for-democratic-nomination/,general,Buttigieg,Pete Buttigieg,DEM,49.1,2020-01-23,2020-01-21,2020-01-23,49.1,0.0,50.9,NO,0.491,-1.8,NA,National,Hybrid
186,116076,63338,2020,National,1102,Emerson College,43,7News,Emerson College,88,Emerson College,A-,1128.0,rv,rv,IVR/Online,U.S. President,0,,1/21/20,2020-01-23,,,False,,,False,False,1/23/20 21:01,,http://emersonpolling.com/2020/01/24/national-2020-biden-and-sanders-battle-in-two-way-race-for-democratic-nomination/,general,Trump,Donald Trump,REP,50.9,2020-01-23,2020-01-21,2020-01-23,50.9,0.0,50.9,YES,0.491,-1.8,NA,National,Hybrid
187,116153,63344,2020,National,11,ABC News/Washington Post,,,ABC News/Washington Post,3,ABC News/Washington Post,A+,1004.0,a,a,Live Phone,U.S. President,0,,1/20/20,2020-01-23,,,False,,,False,False,1/27/20 06:48,,https://www.washingtonpost.com/context/washington-post-abc-news-poll-jan-20-23-2020/50b73242-0f99-4709-b8bc-7e0d56bfe0f3/,general,Biden,Joe Biden,DEM,51.0,2020-01-27,2020-01-20,2020-01-23,51.0,0.0,51.0,YES,0.5368421052631579,7.0,NA,National,Phone
188,116153,63344,2020,National,11,ABC News/Washington Post,,,ABC News/Washington Post,3,ABC News/Washington Post,A+,1004.0,a,a,Live Phone,U.S. President,0,,1/20/20,2020-01-23,,,False,,,False,False,1/27/20 06:48,,https://www.washingtonpost.com/context/washington-post-abc-news-poll-jan-20-23-2020/50b73242-0f99-4709-b8bc-7e0d56bfe0f3/,general,Trump,Donald Trump,REP,44.0,2020-01-27,2020-01-20,2020-01-23,44.0,0.0,51.0,NO,0.5368421052631579,7.0,NA,National,Phone
189,116154,63344,2020,National,11,ABC News/Washington Post,,,ABC News/Washington Post,3,ABC News/Washington Post,A+,1004.0,a,a,Live Phone,U.S. President,0,,1/20/20,2020-01-23,,,False,,,False,False,1/27/20 06:48,,https://www.washingtonpost.com/context/washington-post-abc-news-poll-jan-20-23-2020/50b73242-0f99-4709-b8bc-7e0d56bfe0f3/,general,Sanders,Bernie Sanders,DEM,52.0,2020-01-27,2020-01-20,2020-01-23,52.0,0.0,52.0,YES,0.5416666666666671,8.0,NA,National,Phone
190,116154,63344,2020,National,11,ABC News/Washington Post,,,ABC News/Washington Post,3,ABC News/Washington Post,A+,1004.0,a,a,Live Phone,U.S. President,0,,1/20/20,2020-01-23,,,False,,,False,False,1/27/20 06:48,,https://www.washingtonpost.com/context/washington-post-abc-news-poll-jan-20-23-2020/50b73242-0f99-4709-b8bc-7e0d56bfe0f3/,general,Trump,Donald Trump,REP,44.0,2020-01-27,2020-01-20,2020-01-23,44.0,0.0,52.0,NO,0.5416666666666671,8.0,NA,National,Phone
191,116155,63344,2020,National,11,ABC News/Washington Post,,,ABC News/Washington Post,3,ABC News/Washington Post,A+,1004.0,a,a,Live Phone,U.S. President,0,,1/20/20,2020-01-23,,,False,,,False,False,1/27/20 06:48,,https://www.washingtonpost.com/context/washington-post-abc-news-poll-jan-20-23-2020/50b73242-0f99-4709-b8bc-7e0d56bfe0f3/,general,Warren,Elizabeth Warren,DEM,50.0,2020-01-27,2020-01-20,2020-01-23,50.0,0.0,50.0,YES,0.526315789473684,5.0,NA,National,Phone
192,116155,63344,2020,National,11,ABC News/Washington Post,,,ABC News/Washington Post,3,ABC News/Washington Post,A+,1004.0,a,a,Live Phone,U.S. President,0,,1/20/20,2020-01-23,,,False,,,False,False,1/27/20 06:48,,https://www.washingtonpost.com/context/washington-post-abc-news-poll-jan-20-23-2020/50b73242-0f99-4709-b8bc-7e0d56bfe0f3/,general,Trump,Donald Trump,REP,45.0,2020-01-27,2020-01-20,2020-01-23,45.0,0.0,50.0,NO,0.526315789473684,5.0,NA,National,Phone
193,116156,63344,2020,National,11,ABC News/Washington Post,,,ABC News/Washington Post,3,ABC News/Washington Post,A+,1004.0,a,a,Live Phone,U.S. President,0,,1/20/20,2020-01-23,,,False,,,False,False,1/27/20 06:48,,https://www.washingtonpost.com/context/washington-post-abc-news-poll-jan-20-23-2020/50b73242-0f99-4709-b8bc-7e0d56bfe0f3/,general,Trump,Donald Trump,REP,43.0,2020-01-27,2020-01-20,2020-01-23,43.0,0.0,51.0,NO,0.5425531914893621,8.0,NA,National,Phone
194,116157,63344,2020,National,11,ABC News/Washington Post,,,ABC News/Washington Post,3,ABC News/Washington Post,A+,1004.0,a,a,Live Phone,U.S. President,0,,1/20/20,2020-01-23,,,False,,,False,False,1/27/20 06:48,,https://www.washingtonpost.com/context/washington-post-abc-news-poll-jan-20-23-2020/50b73242-0f99-4709-b8bc-7e0d56bfe0f3/,general,Buttigieg,Pete Buttigieg,DEM,46.0,2020-01-27,2020-01-20,2020-01-23,46.0,0.0,46.0,YES,0.505494505494505,1.0,NA,National,Phone
195,116157,63344,2020,National,11,ABC News/Washington Post,,,ABC News/Washington Post,3,ABC News/Washington Post,A+,1004.0,a,a,Live Phone,U.S. President,0,,1/20/20,2020-01-23,,,False,,,False,False,1/27/20 06:48,,https://www.washingtonpost.com/context/washington-post-abc-news-poll-jan-20-23-2020/50b73242-0f99-4709-b8bc-7e0d56bfe0f3/,general,Trump,Donald Trump,REP,45.0,2020-01-27,2020-01-20,2020-01-23,45.0,0.0,46.0,NO,0.505494505494505,1.0,NA,National,Phone
196,116158,63344,2020,National,11,ABC News/Washington Post,,,ABC News/Washington Post,3,ABC News/Washington Post,A+,1004.0,a,a,Live Phone,U.S. President,0,,1/20/20,2020-01-23,,,False,,,False,False,1/27/20 06:48,,https://www.washingtonpost.com/context/washington-post-abc-news-poll-jan-20-23-2020/50b73242-0f99-4709-b8bc-7e0d56bfe0f3/,general,Klobuchar,Amy Klobuchar,DEM,49.0,2020-01-27,2020-01-20,2020-01-23,49.0,0.0,49.0,YES,0.526881720430108,5.0,NA,National,Phone
197,116158,63344,2020,National,11,ABC News/Washington Post,,,ABC News/Washington Post,3,ABC News/Washington Post,A+,1004.0,a,a,Live Phone,U.S. President,0,,1/20/20,2020-01-23,,,False,,,False,False,1/27/20 06:48,,https://www.washingtonpost.com/context/washington-post-abc-news-poll-jan-20-23-2020/50b73242-0f99-4709-b8bc-7e0d56bfe0f3/,general,Trump,Donald Trump,REP,44.0,2020-01-27,2020-01-20,2020-01-23,44.0,0.0,49.0,NO,0.526881720430108,5.0,NA,National,Phone
198,116159,63344,2020,National,11,ABC News/Washington Post,,,ABC News/Washington Post,3,ABC News/Washington Post,A+,880.0,rv,rv,Live Phone,U.S. President,0,,1/20/20,2020-01-23,,,False,,,False,False,1/27/20 06:48,,https://www.washingtonpost.com/context/washington-post-abc-news-poll-jan-20-23-2020/50b73242-0f99-4709-b8bc-7e0d56bfe0f3/,general,Biden,Joe Biden,DEM,50.0,2020-01-27,2020-01-20,2020-01-23,50.0,0.0,50.0,YES,0.5208333333333329,4.0,NA,National,Phone
199,116159,63344,2020,National,11,ABC News/Washington Post,,,ABC News/Washington Post,3,ABC News/Washington Post,A+,880.0,rv,rv,Live Phone,U.S. President,0,,1/20/20,2020-01-23,,,False,,,False,False,1/27/20 06:48,,https://www.washingtonpost.com/context/washington-post-abc-news-poll-jan-20-23-2020/50b73242-0f99-4709-b8bc-7e0d56bfe0f3/,general,Trump,Donald Trump,REP,46.0,2020-01-27,2020-01-20,2020-01-23,46.0,0.0,50.0,NO,0.5208333333333329,4.0,NA,National,Phone
200,116160,63344,2020,National,11,ABC News/Washington Post,,,ABC News/Washington Post,3,ABC News/Washington Post,A+,880.0,rv,rv,Live Phone,U.S. President,0,,1/20/20,2020-01-23,,,False,,,False,False,1/27/20 06:48,,https://www.washingtonpost.com/context/washington-post-abc-news-poll-jan-20-23-2020/50b73242-0f99-4709-b8bc-7e0d56bfe0f3/,general,Sanders,Bernie Sanders,DEM,49.0,2020-01-27,2020-01-20,2020-01-23,49.0,0.0,49.0,YES,0.5104166666666671,2.0,NA,National,Phone
201,116160,63344,2020,National,11,ABC News/Washington Post,,,ABC News/Washington Post,3,ABC News/Washington Post,A+,880.0,rv,rv,Live Phone,U.S. President,0,,1/20/20,2020-01-23,,,False,,,False,False,1/27/20 06:48,,https://www.washingtonpost.com/context/washington-post-abc-news-poll-jan-20-23-2020/50b73242-0f99-4709-b8bc-7e0d56bfe0f3/,general,Trump,Donald Trump,REP,47.0,2020-01-27,2020-01-20,2020-01-23,47.0,0.0,49.0,NO,0.5104166666666671,2.0,NA,National,Phone
202,116161,63344,2020,National,11,ABC News/Washington Post,,,ABC News/Washington Post,3,ABC News/Washington Post,A+,880.0,rv,rv,Live Phone,U.S. President,0,,1/20/20,2020-01-23,,,False,,,False,False,1/27/20 06:48,,https://www.washingtonpost.com/context/washington-post-abc-news-poll-jan-20-23-2020/50b73242-0f99-4709-b8bc-7e0d56bfe0f3/,general,Warren,Elizabeth Warren,DEM,48.0,2020-01-27,2020-01-20,2020-01-23,48.0,0.0,48.0,YES,0.5,0.0,NA,National,Phone
203,116161,63344,2020,National,11,ABC News/Washington Post,,,ABC News/Washington Post,3,ABC News/Washington Post,A+,880.0,rv,rv,Live Phone,U.S. President,0,,1/20/20,2020-01-23,,,False,,,False,False,1/27/20 06:48,,https://www.washingtonpost.com/context/washington-post-abc-news-poll-jan-20-23-2020/50b73242-0f99-4709-b8bc-7e0d56bfe0f3/,general,Trump,Donald Trump,REP,48.0,2020-01-27,2020-01-20,2020-01-23,48.0,0.0,48.0,YES,0.5,0.0,NA,National,Phone
204,116162,63344,2020,National,11,ABC News/Washington Post,,,ABC News/Washington Post,3,ABC News/Washington Post,A+,880.0,rv,rv,Live Phone,U.S. President,0,,1/20/20,2020-01-23,,,False,,,False,False,1/27/20 06:48,,https://www.washingtonpost.com/context/washington-post-abc-news-poll-jan-20-23-2020/50b73242-0f99-4709-b8bc-7e0d56bfe0f3/,general,Trump,Donald Trump,REP,46.0,2020-01-27,2020-01-20,2020-01-23,46.0,0.0,49.0,NO,0.515789473684211,3.0,NA,National,Phone
205,116163,63344,2020,National,11,ABC News/Washington Post,,,ABC News/Washington Post,3,ABC News/Washington Post,A+,880.0,rv,rv,Live Phone,U.S. President,0,,1/20/20,2020-01-23,,,False,,,False,False,1/27/20 06:48,,https://www.washingtonpost.com/context/washington-post-abc-news-poll-jan-20-23-2020/50b73242-0f99-4709-b8bc-7e0d56bfe0f3/,general,Buttigieg,Pete Buttigieg,DEM,45.0,2020-01-27,2020-01-20,2020-01-23,45.0,0.0,48.0,NO,0.48387096774193505,-3.0,NA,National,Phone
206,116163,63344,2020,National,11,ABC News/Washington Post,,,ABC News/Washington Post,3,ABC News/Washington Post,A+,880.0,rv,rv,Live Phone,U.S. President,0,,1/20/20,2020-01-23,,,False,,,False,False,1/27/20 06:48,,https://www.washingtonpost.com/context/washington-post-abc-news-poll-jan-20-23-2020/50b73242-0f99-4709-b8bc-7e0d56bfe0f3/,general,Trump,Donald Trump,REP,48.0,2020-01-27,2020-01-20,2020-01-23,48.0,0.0,48.0,YES,0.48387096774193505,-3.0,NA,National,Phone
207,116164,63344,2020,National,11,ABC News/Washington Post,,,ABC News/Washington Post,3,ABC News/Washington Post,A+,880.0,rv,rv,Live Phone,U.S. President,0,,1/20/20,2020-01-23,,,False,,,False,False,1/27/20 06:48,,https://www.washingtonpost.com/context/washington-post-abc-news-poll-jan-20-23-2020/50b73242-0f99-4709-b8bc-7e0d56bfe0f3/,general,Klobuchar,Amy Klobuchar,DEM,48.0,2020-01-27,2020-01-20,2020-01-23,48.0,0.0,48.0,YES,0.5052631578947371,1.0,NA,National,Phone
208,116164,63344,2020,National,11,ABC News/Washington Post,,,ABC News/Washington Post,3,ABC News/Washington Post,A+,880.0,rv,rv,Live Phone,U.S. President,0,,1/20/20,2020-01-23,,,False,,,False,False,1/27/20 06:48,,https://www.washingtonpost.com/context/washington-post-abc-news-poll-jan-20-23-2020/50b73242-0f99-4709-b8bc-7e0d56bfe0f3/,general,Trump,Donald Trump,REP,47.0,2020-01-27,2020-01-20,2020-01-23,47.0,0.0,48.0,NO,0.5052631578947371,1.0,NA,National,Phone
209,116094,63347,2020,Iowa,1424,Siena College/New York Times Upshot,,,Siena College/New York Times Upshot,448,Siena College/New York Times Upshot,A+,1689.0,rv,rv,Live Phone,U.S. President,0,,1/20/20,2020-01-23,,,False,,,False,False,1/25/20 05:05,,https://scri.siena.edu/wp-content/uploads/2020/01/IARV0120_84929432651982.pdf,general,Buttigieg,Pete Buttigieg,DEM,44.0,2020-01-25,2020-01-20,2020-01-23,44.0,0.0,45.0,NO,0.49438202247191,-1.0,IA,Midwest,Phone
210,116094,63347,2020,Iowa,1424,Siena College/New York Times Upshot,,,Siena College/New York Times Upshot,448,Siena College/New York Times Upshot,A+,1689.0,rv,rv,Live Phone,U.S. President,0,,1/20/20,2020-01-23,,,False,,,False,False,1/25/20 05:05,,https://scri.siena.edu/wp-content/uploads/2020/01/IARV0120_84929432651982.pdf,general,Trump,Donald Trump,REP,45.0,2020-01-25,2020-01-20,2020-01-23,45.0,0.0,45.0,YES,0.49438202247191,-1.0,IA,Midwest,Phone
211,116095,63347,2020,Iowa,1424,Siena College/New York Times Upshot,,,Siena College/New York Times Upshot,448,Siena College/New York Times Upshot,A+,1689.0,rv,rv,Live Phone,U.S. President,0,,1/20/20,2020-01-23,,,False,,,False,False,1/25/20 05:05,,https://scri.siena.edu/wp-content/uploads/2020/01/IARV0120_84929432651982.pdf,general,Biden,Joe Biden,DEM,44.0,2020-01-25,2020-01-20,2020-01-23,44.0,0.0,46.0,NO,0.48888888888888893,-2.0,IA,Midwest,Phone
212,116095,63347,2020,Iowa,1424,Siena College/New York Times Upshot,,,Siena College/New York Times Upshot,448,Siena College/New York Times Upshot,A+,1689.0,rv,rv,Live Phone,U.S. President,0,,1/20/20,2020-01-23,,,False,,,False,False,1/25/20 05:05,,https://scri.siena.edu/wp-content/uploads/2020/01/IARV0120_84929432651982.pdf,general,Trump,Donald Trump,REP,46.0,2020-01-25,2020-01-20,2020-01-23,46.0,0.0,46.0,YES,0.48888888888888893,-2.0,IA,Midwest,Phone
213,116096,63347,2020,Iowa,1424,Siena College/New York Times Upshot,,,Siena College/New York Times Upshot,448,Siena College/New York Times Upshot,A+,1689.0,rv,rv,Live Phone,U.S. President,0,,1/20/20,2020-01-23,,,False,,,False,False,1/25/20 05:05,,https://scri.siena.edu/wp-content/uploads/2020/01/IARV0120_84929432651982.pdf,general,Klobuchar,Amy Klobuchar,DEM,41.0,2020-01-25,2020-01-20,2020-01-23,41.0,0.0,46.0,NO,0.4712643678160921,-5.0,IA,Midwest,Phone
214,116096,63347,2020,Iowa,1424,Siena College/New York Times Upshot,,,Siena College/New York Times Upshot,448,Siena College/New York Times Upshot,A+,1689.0,rv,rv,Live Phone,U.S. President,0,,1/20/20,2020-01-23,,,False,,,False,False,1/25/20 05:05,,https://scri.siena.edu/wp-content/uploads/2020/01/IARV0120_84929432651982.pdf,general,Trump,Donald Trump,REP,46.0,2020-01-25,2020-01-20,2020-01-23,46.0,0.0,46.0,YES,0.4712643678160921,-5.0,IA,Midwest,Phone
215,116097,63347,2020,Iowa,1424,Siena College/New York Times Upshot,,,Siena College/New York Times Upshot,448,Siena College/New York Times Upshot,A+,1689.0,rv,rv,Live Phone,U.S. President,0,,1/20/20,2020-01-23,,,False,,,False,False,1/25/20 05:05,,https://scri.siena.edu/wp-content/uploads/2020/01/IARV0120_84929432651982.pdf,general,Warren,Elizabeth Warren,DEM,42.0,2020-01-25,2020-01-20,2020-01-23,42.0,0.0,47.0,NO,0.47191011235955105,-5.0,IA,Midwest,Phone
216,116097,63347,2020,Iowa,1424,Siena College/New York Times Upshot,,,Siena College/New York Times Upshot,448,Siena College/New York Times Upshot,A+,1689.0,rv,rv,Live Phone,U.S. President,0,,1/20/20,2020-01-23,,,False,,,False,False,1/25/20 05:05,,https://scri.siena.edu/wp-content/uploads/2020/01/IARV0120_84929432651982.pdf,general,Trump,Donald Trump,REP,47.0,2020-01-25,2020-01-20,2020-01-23,47.0,0.0,47.0,YES,0.47191011235955105,-5.0,IA,Midwest,Phone
217,116098,63347,2020,Iowa,1424,Siena College/New York Times Upshot,,,Siena College/New York Times Upshot,448,Siena College/New York Times Upshot,A+,1689.0,rv,rv,Live Phone,U.S. President,0,,1/20/20,2020-01-23,,,False,,,False,False,1/25/20 05:05,,https://scri.siena.edu/wp-content/uploads/2020/01/IARV0120_84929432651982.pdf,general,Sanders,Bernie Sanders,DEM,42.0,2020-01-25,2020-01-20,2020-01-23,42.0,0.0,48.0,NO,0.46666666666666706,-6.0,IA,Midwest,Phone
218,116098,63347,2020,Iowa,1424,Siena College/New York Times Upshot,,,Siena College/New York Times Upshot,448,Siena College/New York Times Upshot,A+,1689.0,rv,rv,Live Phone,U.S. President,0,,1/20/20,2020-01-23,,,False,,,False,False,1/25/20 05:05,,https://scri.siena.edu/wp-content/uploads/2020/01/IARV0120_84929432651982.pdf,general,Trump,Donald Trump,REP,48.0,2020-01-25,2020-01-20,2020-01-23,48.0,0.0,48.0,YES,0.46666666666666706,-6.0,IA,Midwest,Phone
219,116099,63347,2020,Iowa,1424,Siena College/New York Times Upshot,,,Siena College/New York Times Upshot,448,Siena College/New York Times Upshot,A+,1689.0,rv,rv,Live Phone,U.S. President,0,,1/20/20,2020-01-23,,,False,,,False,False,1/25/20 05:05,,https://scri.siena.edu/wp-content/uploads/2020/01/IARV0120_84929432651982.pdf,general,Trump,Donald Trump,REP,47.0,2020-01-25,2020-01-20,2020-01-23,47.0,0.0,47.0,YES,0.4534883720930229,-8.0,IA,Midwest,Phone
220,116138,63351,2020,New Hampshire,1205,Marist College,132,NBC News,Marist College,183,Marist College,A+,2223.0,rv,rv,Live Phone,U.S. President,0,,1/20/20,2020-01-23,,,False,,,False,False,1/26/20 09:04,,http://maristpoll.marist.edu/wp-content/uploads/2020/01/NBC-News_Marist-Poll_NH-NOS-and-Tables_2001241124.pdf,general,Biden,Joe Biden,DEM,51.0,2020-01-26,2020-01-20,2020-01-23,51.0,0.0,51.0,YES,0.5425531914893621,8.0,NH,North,Phone
221,116138,63351,2020,New Hampshire,1205,Marist College,132,NBC News,Marist College,183,Marist College,A+,2223.0,rv,rv,Live Phone,U.S. President,0,,1/20/20,2020-01-23,,,False,,,False,False,1/26/20 09:04,,http://maristpoll.marist.edu/wp-content/uploads/2020/01/NBC-News_Marist-Poll_NH-NOS-and-Tables_2001241124.pdf,general,Trump,Donald Trump,REP,43.0,2020-01-26,2020-01-20,2020-01-23,43.0,0.0,51.0,NO,0.5425531914893621,8.0,NH,North,Phone
222,116139,63351,2020,New Hampshire,1205,Marist College,132,NBC News,Marist College,183,Marist College,A+,2223.0,rv,rv,Live Phone,U.S. President,0,,1/20/20,2020-01-23,,,False,,,False,False,1/26/20 09:04,,http://maristpoll.marist.edu/wp-content/uploads/2020/01/NBC-News_Marist-Poll_NH-NOS-and-Tables_2001241124.pdf,general,Warren,Elizabeth Warren,DEM,48.0,2020-01-26,2020-01-20,2020-01-23,48.0,0.0,48.0,YES,0.5217391304347829,4.0,NH,North,Phone
223,116139,63351,2020,New Hampshire,1205,Marist College,132,NBC News,Marist College,183,Marist College,A+,2223.0,rv,rv,Live Phone,U.S. President,0,,1/20/20,2020-01-23,,,False,,,False,False,1/26/20 09:04,,http://maristpoll.marist.edu/wp-content/uploads/2020/01/NBC-News_Marist-Poll_NH-NOS-and-Tables_2001241124.pdf,general,Trump,Donald Trump,REP,44.0,2020-01-26,2020-01-20,2020-01-23,44.0,0.0,48.0,NO,0.5217391304347829,4.0,NH,North,Phone
224,116140,63351,2020,New Hampshire,1205,Marist College,132,NBC News,Marist College,183,Marist College,A+,2223.0,rv,rv,Live Phone,U.S. President,0,,1/20/20,2020-01-23,,,False,,,False,False,1/26/20 09:04,,http://maristpoll.marist.edu/wp-content/uploads/2020/01/NBC-News_Marist-Poll_NH-NOS-and-Tables_2001241124.pdf,general,Sanders,Bernie Sanders,DEM,51.0,2020-01-26,2020-01-20,2020-01-23,51.0,0.0,51.0,YES,0.5425531914893621,8.0,NH,North,Phone
225,116140,63351,2020,New Hampshire,1205,Marist College,132,NBC News,Marist College,183,Marist College,A+,2223.0,rv,rv,Live Phone,U.S. President,0,,1/20/20,2020-01-23,,,False,,,False,False,1/26/20 09:04,,http://maristpoll.marist.edu/wp-content/uploads/2020/01/NBC-News_Marist-Poll_NH-NOS-and-Tables_2001241124.pdf,general,Trump,Donald Trump,REP,43.0,2020-01-26,2020-01-20,2020-01-23,43.0,0.0,51.0,NO,0.5425531914893621,8.0,NH,North,Phone
226,116141,63351,2020,New Hampshire,1205,Marist College,132,NBC News,Marist College,183,Marist College,A+,2223.0,rv,rv,Live Phone,U.S. President,0,,1/20/20,2020-01-23,,,False,,,False,False,1/26/20 09:04,,http://maristpoll.marist.edu/wp-content/uploads/2020/01/NBC-News_Marist-Poll_NH-NOS-and-Tables_2001241124.pdf,general,Buttigieg,Pete Buttigieg,DEM,51.0,2020-01-26,2020-01-20,2020-01-23,51.0,0.0,51.0,YES,0.554347826086957,10.0,NH,North,Phone
227,116141,63351,2020,New Hampshire,1205,Marist College,132,NBC News,Marist College,183,Marist College,A+,2223.0,rv,rv,Live Phone,U.S. President,0,,1/20/20,2020-01-23,,,False,,,False,False,1/26/20 09:04,,http://maristpoll.marist.edu/wp-content/uploads/2020/01/NBC-News_Marist-Poll_NH-NOS-and-Tables_2001241124.pdf,general,Trump,Donald Trump,REP,41.0,2020-01-26,2020-01-20,2020-01-23,41.0,0.0,51.0,NO,0.554347826086957,10.0,NH,North,Phone
228,116342,63390,2020,Missouri,24,American Viewpoint,1232,Uniting Missouri PAC,American Viewpoint,10,American Viewpoint,A/B,1200.0,lv,lv,Live Phone,U.S. President,0,,1/20/20,2020-01-22,,,False,REP,,False,False,1/29/20 11:24,,https://moscout.com/s/MO-Statewide-IP-Memo_Jan-20.pdf,general,Biden,Joe Biden,DEM,43.0,2020-01-29,2020-01-20,2020-01-22,43.0,0.0,50.0,NO,0.462365591397849,-7.0,MO,Midwest,Phone
229,116342,63390,2020,Missouri,24,American Viewpoint,1232,Uniting Missouri PAC,American Viewpoint,10,American Viewpoint,A/B,1200.0,lv,lv,Live Phone,U.S. President,0,,1/20/20,2020-01-22,,,False,REP,,False,False,1/29/20 11:24,,https://moscout.com/s/MO-Statewide-IP-Memo_Jan-20.pdf,general,Trump,Donald Trump,REP,50.0,2020-01-29,2020-01-20,2020-01-22,50.0,0.0,50.0,YES,0.462365591397849,-7.0,MO,Midwest,Phone
230,116343,63390,2020,Missouri,24,American Viewpoint,1232,Uniting Missouri PAC,American Viewpoint,10,American Viewpoint,A/B,1200.0,lv,lv,Live Phone,U.S. President,0,,1/20/20,2020-01-22,,,False,REP,,False,False,1/29/20 11:24,,https://moscout.com/s/MO-Statewide-IP-Memo_Jan-20.pdf,general,Warren,Elizabeth Warren,DEM,41.0,2020-01-29,2020-01-20,2020-01-22,41.0,0.0,51.0,NO,0.445652173913043,-10.0,MO,Midwest,Phone
231,116343,63390,2020,Missouri,24,American Viewpoint,1232,Uniting Missouri PAC,American Viewpoint,10,American Viewpoint,A/B,1200.0,lv,lv,Live Phone,U.S. President,0,,1/20/20,2020-01-22,,,False,REP,,False,False,1/29/20 11:24,,https://moscout.com/s/MO-Statewide-IP-Memo_Jan-20.pdf,general,Trump,Donald Trump,REP,51.0,2020-01-29,2020-01-20,2020-01-22,51.0,0.0,51.0,YES,0.445652173913043,-10.0,MO,Midwest,Phone
